序号,标题,链接,创建时间,状态,标签
1,oid v.s. void bat behavior,https://github.com/MonetDB/MonetDB/issues/1,2020-11-30T07:59:53Z,CLOSED,['bug']
2,join uses wrong column (?),https://github.com/MonetDB/MonetDB/issues/2,2020-11-30T07:59:56Z,CLOSED,['bug']
3,marking a void-T table nil,https://github.com/MonetDB/MonetDB/issues/3,2020-11-30T07:59:59Z,CLOSED,['bug']
4,kunique fails with empty strings,https://github.com/MonetDB/MonetDB/issues/6,2020-11-30T08:00:09Z,CLOSED,['bug']
5,weird code in interpret_file,https://github.com/MonetDB/MonetDB/issues/7,2020-11-30T08:00:12Z,CLOSED,['bug']
6,uninitialized local variable,https://github.com/MonetDB/MonetDB/issues/8,2020-11-30T08:00:15Z,CLOSED,['bug']
7,"Refcount warnings in ""varval""",https://github.com/MonetDB/MonetDB/issues/10,2020-11-30T08:00:21Z,CLOSED,['bug']
8,Bug in kintersect,https://github.com/MonetDB/MonetDB/issues/11,2020-11-30T08:00:23Z,CLOSED,['bug']
9,NaN / Inf test on Windows give wrong result,https://github.com/MonetDB/MonetDB/issues/13,2020-11-30T08:00:30Z,CLOSED,['bug']
10,radix.mx: cast to pointer from integer of different size,https://github.com/MonetDB/MonetDB/issues/14,2020-11-30T08:00:33Z,CLOSED,['bug']
11,Return types of head() and tail() do not match description,https://github.com/MonetDB/MonetDB/issues/15,2020-11-30T08:00:35Z,CLOSED,['bug']
12,decimal(0) = nil on SunOS-native,https://github.com/MonetDB/MonetDB/issues/18,2020-11-30T08:00:43Z,CLOSED,['bug']
13,xtables test hangs / takes 9 hours,https://github.com/MonetDB/MonetDB/issues/19,2020-11-30T08:00:46Z,CLOSED,['bug']
14,abort does not work as expected,https://github.com/MonetDB/MonetDB/issues/20,2020-11-30T08:00:48Z,CLOSED,['bug']
15,BAT leak in xtables with histogram on view,https://github.com/MonetDB/MonetDB/issues/22,2020-11-30T08:00:54Z,CLOSED,['bug']
16,header decoding in Java Mapi,https://github.com/MonetDB/MonetDB/issues/23,2020-11-30T08:00:57Z,CLOSED,['bug']
17,error messages too long,https://github.com/MonetDB/MonetDB/issues/25,2020-11-30T08:01:03Z,CLOSED,['bug']
18,Use of undeclared function: strtof,https://github.com/MonetDB/MonetDB/issues/26,2020-11-30T08:01:07Z,CLOSED,['bug']
19,C-Mapi does not work on Windows,https://github.com/MonetDB/MonetDB/issues/28,2020-11-30T08:01:13Z,CLOSED,['bug']
20,Build on SuSE 8.1 fails with --enable-optimize,https://github.com/MonetDB/MonetDB/issues/29,2020-11-30T08:01:16Z,CLOSED,['bug']
21,libperfctr.h and ANSI C (inline),https://github.com/MonetDB/MonetDB/issues/30,2020-11-30T08:01:20Z,CLOSED,['bug']
22,Mserver segfault in insert_delta,https://github.com/MonetDB/MonetDB/issues/32,2020-11-30T08:01:27Z,CLOSED,['bug']
23,Crash on insert,https://github.com/MonetDB/MonetDB/issues/33,2020-11-30T08:01:31Z,CLOSED,['bug']
24,ADT var not available,https://github.com/MonetDB/MonetDB/issues/34,2020-11-30T08:01:34Z,CLOSED,['bug']
25,Msql crashed on Windows,https://github.com/MonetDB/MonetDB/issues/35,2020-11-30T08:01:37Z,CLOSED,['bug']
26,Mserver segfault with module sql_server,https://github.com/MonetDB/MonetDB/issues/36,2020-11-30T08:01:41Z,CLOSED,['bug']
27,"MapiClient hangs on ""wrong"" rename",https://github.com/MonetDB/MonetDB/issues/37,2020-11-30T08:01:43Z,CLOSED,['bug']
28,Confusing error report in Mapi,https://github.com/MonetDB/MonetDB/issues/38,2020-11-30T08:01:47Z,CLOSED,['bug']
29,Mserver segfault (module sql_server),https://github.com/MonetDB/MonetDB/issues/40,2020-11-30T08:01:52Z,CLOSED,['bug']
30,BerkeleyDB support/usage broken in pf-shred,https://github.com/MonetDB/MonetDB/issues/42,2020-11-30T08:01:58Z,CLOSED,['bug']
31,SQL feature missing,https://github.com/MonetDB/MonetDB/issues/44,2020-11-30T08:02:04Z,CLOSED,['bug']
32,instable MAPI on 32-bit Linux,https://github.com/MonetDB/MonetDB/issues/47,2020-11-30T08:02:13Z,CLOSED,['bug']
33,MAPI Xexport in multithreaded use gives segmentation error,https://github.com/MonetDB/MonetDB/issues/48,2020-11-30T08:02:16Z,CLOSED,['bug']
34,SQL select error,https://github.com/MonetDB/MonetDB/issues/52,2020-11-30T08:02:28Z,CLOSED,['bug']
35,SQL 'delete from _tmp' error,https://github.com/MonetDB/MonetDB/issues/53,2020-11-30T08:02:32Z,CLOSED,['bug']
36,Log manager,https://github.com/MonetDB/MonetDB/issues/54,2020-11-30T08:02:35Z,CLOSED,['bug']
37,SQL transactions,https://github.com/MonetDB/MonetDB/issues/55,2020-11-30T08:02:38Z,CLOSED,['bug']
38,Dealing with temporary tables,https://github.com/MonetDB/MonetDB/issues/56,2020-11-30T08:02:41Z,CLOSED,['bug']
39,exit Mserver upon cntrl-d,https://github.com/MonetDB/MonetDB/issues/57,2020-11-30T08:02:43Z,CLOSED,['bug']
40,MIL parser cannot handle Ctrl-M (CR),https://github.com/MonetDB/MonetDB/issues/59,2020-11-30T08:02:48Z,CLOSED,['bug']
41,tests tst_mmap & tst_writestr segfault in gdk_atom:strPu,https://github.com/MonetDB/MonetDB/issues/61,2020-11-30T08:02:54Z,CLOSED,['bug']
42,Concurrency conflict in catalog,https://github.com/MonetDB/MonetDB/issues/63,2020-11-30T08:02:58Z,CLOSED,['bug']
43,Bus error on full disk,https://github.com/MonetDB/MonetDB/issues/64,2020-11-30T08:03:01Z,CLOSED,['bug']
44,Multiple Mservers,https://github.com/MonetDB/MonetDB/issues/67,2020-11-30T08:03:11Z,CLOSED,['bug']
45,Incorrect $t/$h use in MIL crashes Mserver,https://github.com/MonetDB/MonetDB/issues/69,2020-11-30T08:03:16Z,CLOSED,['bug']
46,gdk_utils does not compile on Windows,https://github.com/MonetDB/MonetDB/issues/70,2020-11-30T08:03:19Z,CLOSED,['bug']
47,test salgebra fails after yesterday's changes,https://github.com/MonetDB/MonetDB/issues/71,2020-11-30T08:03:22Z,CLOSED,['bug']
48,Error message when autoconf etc. missing not clear,https://github.com/MonetDB/MonetDB/issues/72,2020-11-30T08:03:25Z,CLOSED,['bug']
49,"""Mserver internal error, please restart."" on Linux",https://github.com/MonetDB/MonetDB/issues/74,2020-11-30T08:03:30Z,CLOSED,['bug']
50,rangesplit() fp exception on 0 chuncks,https://github.com/MonetDB/MonetDB/issues/75,2020-11-30T08:03:34Z,CLOSED,['bug']
51,Assertion triggered in make_persistent,https://github.com/MonetDB/MonetDB/issues/76,2020-11-30T08:03:37Z,CLOSED,['bug']
52,CVS checkin mails get wrong subject,https://github.com/MonetDB/MonetDB/issues/77,2020-11-30T08:03:40Z,CLOSED,['bug']
53,Internal error,https://github.com/MonetDB/MonetDB/issues/78,2020-11-30T08:03:43Z,CLOSED,['bug']
54,"rangespilt(b,1); fails on 64-bit Linux",https://github.com/MonetDB/MonetDB/issues/79,2020-11-30T08:03:46Z,CLOSED,['bug']
55,utf-8 handling/printing broken with Java-1.4,https://github.com/MonetDB/MonetDB/issues/80,2020-11-30T08:03:48Z,CLOSED,['bug']
56,"Wrong ""QUERY="" in MAPI error messages",https://github.com/MonetDB/MonetDB/issues/82,2020-11-30T08:03:55Z,CLOSED,['bug']
57,tests hang on Windows with VC .NET,https://github.com/MonetDB/MonetDB/issues/83,2020-11-30T08:03:58Z,CLOSED,['bug']
58,Table header from,https://github.com/MonetDB/MonetDB/issues/84,2020-11-30T08:04:01Z,CLOSED,['bug']
59,semijoin nil == nil,https://github.com/MonetDB/MonetDB/issues/87,2020-11-30T08:04:10Z,CLOSED,['bug']
60,Elementary type errors crash server,https://github.com/MonetDB/MonetDB/issues/89,2020-11-30T08:04:16Z,CLOSED,['bug']
61,Core SQL language,https://github.com/MonetDB/MonetDB/issues/91,2020-11-30T08:04:22Z,CLOSED,['bug']
62,SQL cross join crashes server,https://github.com/MonetDB/MonetDB/issues/92,2020-11-30T08:04:25Z,CLOSED,['bug']
63,SQL null <-> behavior,https://github.com/MonetDB/MonetDB/issues/93,2020-11-30T08:04:29Z,CLOSED,['bug']
64,Hanging processes,https://github.com/MonetDB/MonetDB/issues/94,2020-11-30T08:04:32Z,CLOSED,['bug']
65,String length constraints,https://github.com/MonetDB/MonetDB/issues/96,2020-11-30T08:04:39Z,CLOSED,['bug']
66,select null impossible?,https://github.com/MonetDB/MonetDB/issues/100,2020-11-30T08:04:52Z,CLOSED,['bug']
67,Possible intermediate result problem? WAS:crash on long quer,https://github.com/MonetDB/MonetDB/issues/101,2020-11-30T08:04:56Z,CLOSED,['bug']
68,broken links in html documentation,https://github.com/MonetDB/MonetDB/issues/103,2020-11-30T08:05:03Z,CLOSED,['bug']
69,SQL: extremely long and complex query causes SEGFAULT,https://github.com/MonetDB/MonetDB/issues/104,2020-11-30T08:05:06Z,CLOSED,['bug']
70,sudden death from SQL server,https://github.com/MonetDB/MonetDB/issues/105,2020-11-30T08:05:11Z,CLOSED,['bug']
71,find(nil) matches any void head in BAT with seqbase,https://github.com/MonetDB/MonetDB/issues/106,2020-11-30T08:05:14Z,CLOSED,['bug']
72,Insert crashes the server,https://github.com/MonetDB/MonetDB/issues/108,2020-11-30T08:05:19Z,CLOSED,['bug']
73,SQL type error in self-insert,https://github.com/MonetDB/MonetDB/issues/109,2020-11-30T08:05:22Z,CLOSED,['bug']
74,SQL union limitation,https://github.com/MonetDB/MonetDB/issues/110,2020-11-30T08:05:24Z,CLOSED,['bug']
75,isnil(timestamp(nil)) = false,https://github.com/MonetDB/MonetDB/issues/113,2020-11-30T08:05:32Z,CLOSED,['bug']
76,SQL basic arithmetic,https://github.com/MonetDB/MonetDB/issues/115,2020-11-30T08:05:37Z,CLOSED,['bug']
77,SQL null and columns,https://github.com/MonetDB/MonetDB/issues/116,2020-11-30T08:12:15Z,CLOSED,['bug']
78,double numbers,https://github.com/MonetDB/MonetDB/issues/117,2020-11-30T08:12:18Z,CLOSED,['bug']
79,MapiClient discards lasts line of file,https://github.com/MonetDB/MonetDB/issues/118,2020-11-30T08:12:21Z,CLOSED,['bug']
80,SQL: COPY x RECORDS FROM stdin USING DELIMITER '\t'; fails,https://github.com/MonetDB/MonetDB/issues/119,2020-11-30T08:12:24Z,CLOSED,['bug']
81,SQL: UPDATE table SET column = null fails,https://github.com/MonetDB/MonetDB/issues/120,2020-11-30T08:12:27Z,CLOSED,['bug']
82,tail role ignored by print(bat),https://github.com/MonetDB/MonetDB/issues/121,2020-11-30T08:12:30Z,CLOSED,['bug']
83,Having syntax crashes server,https://github.com/MonetDB/MonetDB/issues/122,2020-11-30T08:12:33Z,CLOSED,['bug']
84,Monet gives lots of errors on startup of fresh install,https://github.com/MonetDB/MonetDB/issues/124,2020-11-30T08:12:39Z,CLOSED,['bug']
85,Compilation on Suse,https://github.com/MonetDB/MonetDB/issues/125,2020-11-30T08:12:42Z,CLOSED,['bug']
86,Melt down: VOC update statements,https://github.com/MonetDB/MonetDB/issues/126,2020-11-30T08:12:45Z,CLOSED,['bug']
87,mapi_query() incorrect behaviour,https://github.com/MonetDB/MonetDB/issues/128,2020-11-30T08:12:52Z,CLOSED,['bug']
88,Slow counting,https://github.com/MonetDB/MonetDB/issues/129,2020-11-30T08:12:55Z,CLOSED,['bug']
89,History table not updated,https://github.com/MonetDB/MonetDB/issues/130,2020-11-30T08:12:58Z,CLOSED,['bug']
90,Mknife broken on SQL,https://github.com/MonetDB/MonetDB/issues/132,2020-11-30T08:14:09Z,CLOSED,['bug']
91,Crash on erroneous monet.conf,https://github.com/MonetDB/MonetDB/issues/134,2020-11-30T08:14:16Z,CLOSED,['bug']
92,monet_client/Mapi error on SunOS,https://github.com/MonetDB/MonetDB/issues/135,2020-11-30T08:14:18Z,CLOSED,['bug']
93,bad var-sized atom (str) heap performance on 64-bit,https://github.com/MonetDB/MonetDB/issues/136,2020-11-30T08:14:22Z,CLOSED,['bug']
94,Savepoints only partly implemented?,https://github.com/MonetDB/MonetDB/issues/137,2020-11-30T08:14:26Z,CLOSED,['bug']
95,Exploding print cost,https://github.com/MonetDB/MonetDB/issues/138,2020-11-30T08:14:28Z,CLOSED,['bug']
96,Crash server with MapiClient,https://github.com/MonetDB/MonetDB/issues/139,2020-11-30T08:14:32Z,CLOSED,['bug']
97,SQL: CREATE INDEX / UNIQUE,https://github.com/MonetDB/MonetDB/issues/143,2020-11-30T08:14:42Z,CLOSED,['bug']
98,SQL: timestamp crashes monet or returns null on parse error,https://github.com/MonetDB/MonetDB/issues/144,2020-11-30T08:14:45Z,CLOSED,['bug']
99,Mserver exits if loading sql_server fails on logdir,https://github.com/MonetDB/MonetDB/issues/145,2020-11-30T08:14:48Z,CLOSED,['bug']
100,GDKvmalloc failed on load_data,https://github.com/MonetDB/MonetDB/issues/146,2020-11-30T08:14:51Z,CLOSED,['bug']
101,SQL: column types from system tables weird,https://github.com/MonetDB/MonetDB/issues/147,2020-11-30T08:14:54Z,CLOSED,['bug']
102,aggregates do not work on void,https://github.com/MonetDB/MonetDB/issues/148,2020-11-30T08:14:58Z,CLOSED,['bug']
103,Handling string-> float coercions,https://github.com/MonetDB/MonetDB/issues/149,2020-11-30T08:15:00Z,CLOSED,['bug']
104,Drop indices crashes server,https://github.com/MonetDB/MonetDB/issues/152,2020-11-30T08:15:09Z,CLOSED,['bug']
105,GDKvmalloc failed using COPY INTO,https://github.com/MonetDB/MonetDB/issues/154,2020-11-30T08:15:15Z,CLOSED,['bug']
106,CREATE TABLE t1 ( a1 INTEGER DEFAULT 0 ); crashes server,https://github.com/MonetDB/MonetDB/issues/156,2020-11-30T08:15:22Z,CLOSED,['bug']
107,"SET reply_size = true is allowed, SET auto_commit = 20 ?",https://github.com/MonetDB/MonetDB/issues/159,2020-11-30T08:15:30Z,CLOSED,['bug']
108,SQL: ROLLBACK and RELEASE don't care about the savepoint?!?,https://github.com/MonetDB/MonetDB/issues/160,2020-11-30T08:15:33Z,CLOSED,['bug']
109,SQL: each column NOT NULL on Mac OS X 10.2.8?,https://github.com/MonetDB/MonetDB/issues/161,2020-11-30T08:15:36Z,CLOSED,['bug']
110,drop schema crashes server,https://github.com/MonetDB/MonetDB/issues/164,2020-11-30T08:15:47Z,CLOSED,['bug']
111,Singleton (view) table problem,https://github.com/MonetDB/MonetDB/issues/165,2020-11-30T08:15:50Z,CLOSED,['bug']
112,m means minute AND millisecond,https://github.com/MonetDB/MonetDB/issues/166,2020-11-30T08:15:53Z,CLOSED,['bug']
113,monettime needs alarm module,https://github.com/MonetDB/MonetDB/issues/167,2020-11-30T08:15:56Z,CLOSED,['bug']
114,foreign key constraint in frontend crashes backend,https://github.com/MonetDB/MonetDB/issues/171,2020-11-30T08:16:08Z,CLOSED,['bug']
115,"Types boolean(0,0) (bit) and bool(0,0) (bit) are not equal",https://github.com/MonetDB/MonetDB/issues/172,2020-11-30T08:16:12Z,CLOSED,['bug']
116,SELECT on view only works once,https://github.com/MonetDB/MonetDB/issues/174,2020-11-30T08:16:18Z,CLOSED,['bug']
117,MapiClient && blocked != true?,https://github.com/MonetDB/MonetDB/issues/175,2020-11-30T08:16:22Z,CLOSED,['bug']
118,assertion failed on,https://github.com/MonetDB/MonetDB/issues/176,2020-11-30T08:16:25Z,CLOSED,['bug']
119,Pathfinder does not function properly with NDEBUG,https://github.com/MonetDB/MonetDB/issues/178,2020-11-30T08:16:31Z,CLOSED,['bug']
120,SQL: UNION ALL acts like UNION DISTINCT,https://github.com/MonetDB/MonetDB/issues/179,2020-11-30T08:16:34Z,CLOSED,['bug']
121,SQL: infinite repeating message ! TODO: stmt_reset(2=var),https://github.com/MonetDB/MonetDB/issues/180,2020-11-30T08:16:36Z,CLOSED,['bug']
122,Weird view behaviour,https://github.com/MonetDB/MonetDB/issues/183,2020-11-30T08:16:46Z,CLOSED,['bug']
123,custom function in where clause,https://github.com/MonetDB/MonetDB/issues/184,2020-11-30T08:16:50Z,CLOSED,['bug']
124,crash after cast,https://github.com/MonetDB/MonetDB/issues/186,2020-11-30T08:16:56Z,CLOSED,['bug']
125,DEFAULT values,https://github.com/MonetDB/MonetDB/issues/187,2020-11-30T08:16:59Z,CLOSED,['bug']
126,View on non-existent table crashes server,https://github.com/MonetDB/MonetDB/issues/189,2020-11-30T08:17:06Z,CLOSED,['bug']
127,wrong(?) alternative foreign key syntax crashes server,https://github.com/MonetDB/MonetDB/issues/192,2020-11-30T08:17:18Z,CLOSED,['bug']
128,SQL: !Column: columns.mediumint unknown,https://github.com/MonetDB/MonetDB/issues/193,2020-11-30T08:17:21Z,CLOSED,['bug']
129,SQL-Guide is not linked,https://github.com/MonetDB/MonetDB/issues/194,2020-11-30T08:17:24Z,CLOSED,['bug']
130,make html in SQL fails,https://github.com/MonetDB/MonetDB/issues/195,2020-11-30T08:17:27Z,CLOSED,['bug']
131,'SELECT DISTINCT 1 from tables' fails,https://github.com/MonetDB/MonetDB/issues/196,2020-11-30T08:17:30Z,CLOSED,['bug']
132,SQL: Meltdown: cartesian product crashes server?,https://github.com/MonetDB/MonetDB/issues/199,2020-11-30T08:17:40Z,CLOSED,['bug']
133,SQL set instruction crashes server,https://github.com/MonetDB/MonetDB/issues/200,2020-11-30T08:17:44Z,CLOSED,['bug']
134,"""join"" seems broken since bug fix #936469",https://github.com/MonetDB/MonetDB/issues/201,2020-11-30T08:17:48Z,CLOSED,['bug']
135,latest code changes do not compile with GNU 64-bit,https://github.com/MonetDB/MonetDB/issues/202,2020-11-30T08:17:51Z,CLOSED,['bug']
136,"SQL: Monet lies, cheats and bugs on UNION subquery",https://github.com/MonetDB/MonetDB/issues/203,2020-11-30T08:17:54Z,CLOSED,['bug']
137,SQL: Single subquery query inpossible?,https://github.com/MonetDB/MonetDB/issues/204,2020-11-30T08:17:57Z,CLOSED,['bug']
138,SQL: unable to use column names in outer select,https://github.com/MonetDB/MonetDB/issues/205,2020-11-30T08:18:00Z,CLOSED,['bug']
139,latest check-ins break compilation of GDK ! |-(,https://github.com/MonetDB/MonetDB/issues/206,2020-11-30T08:18:04Z,CLOSED,['bug']
140,SQL: cannot use variable argument in SUBSTRING,https://github.com/MonetDB/MonetDB/issues/207,2020-11-30T08:18:07Z,CLOSED,['bug']
141,SQL: variable arguments in functions in HAVING clause,https://github.com/MonetDB/MonetDB/issues/208,2020-11-30T08:18:10Z,CLOSED,['bug']
142,kernel documentation misses bibliography,https://github.com/MonetDB/MonetDB/issues/209,2020-11-30T08:18:13Z,CLOSED,['bug']
143,SQL: column references in JOIN,https://github.com/MonetDB/MonetDB/issues/210,2020-11-30T08:18:15Z,CLOSED,['bug']
144,SQL: Meltdown on JDBC query,https://github.com/MonetDB/MonetDB/issues/211,2020-11-30T08:18:18Z,CLOSED,['bug']
145,SQL: Server crash in HAVING clause,https://github.com/MonetDB/MonetDB/issues/214,2020-11-30T08:18:28Z,CLOSED,['bug']
146,SQL: HAVING clause quirks,https://github.com/MonetDB/MonetDB/issues/215,2020-11-30T08:18:31Z,CLOSED,['bug']
147,bootstrap fails on apps and spin,https://github.com/MonetDB/MonetDB/issues/216,2020-11-30T08:18:34Z,CLOSED,['bug']
148,compiling MonetDB failes on Cygwin,https://github.com/MonetDB/MonetDB/issues/217,2020-11-30T08:18:38Z,CLOSED,['bug']
149,"""make rpm"" fails",https://github.com/MonetDB/MonetDB/issues/218,2020-11-30T08:18:41Z,CLOSED,['bug']
150,SQL: Join with single-row subquery does not work,https://github.com/MonetDB/MonetDB/issues/220,2020-11-30T08:18:47Z,CLOSED,['bug']
151,SQL: 'insert..select..group by' fails null constraint,https://github.com/MonetDB/MonetDB/issues/221,2020-11-30T08:18:51Z,CLOSED,['bug']
152,SQL: Floating point '/' broken?,https://github.com/MonetDB/MonetDB/issues/223,2020-11-30T08:18:58Z,CLOSED,['bug']
153,SQL: variable arguments in CAST function,https://github.com/MonetDB/MonetDB/issues/224,2020-11-30T08:19:01Z,CLOSED,['bug']
154,SQL: count(*) alias in subselect,https://github.com/MonetDB/MonetDB/issues/226,2020-11-30T08:19:07Z,CLOSED,['bug']
155,SQL compilation fails on odbc/python,https://github.com/MonetDB/MonetDB/issues/228,2020-11-30T08:19:15Z,CLOSED,['bug']
156,SQL: Meltdown on START TRANSACTION,https://github.com/MonetDB/MonetDB/issues/229,2020-11-30T08:19:18Z,CLOSED,['bug']
157,SQL: NUMERIC datatype not supported completely?,https://github.com/MonetDB/MonetDB/issues/230,2020-11-30T08:19:22Z,CLOSED,['bug']
158,SQL: Meltdown on COMMIT in auto_commit mode,https://github.com/MonetDB/MonetDB/issues/231,2020-11-30T08:19:25Z,CLOSED,['bug']
159,SQL: JDBC savepoints test crashes Mserver,https://github.com/MonetDB/MonetDB/issues/233,2020-11-30T08:19:32Z,CLOSED,['bug']
160,test src/mapi/Tests/sample3 failes after recent changes,https://github.com/MonetDB/MonetDB/issues/235,2020-11-30T08:19:38Z,CLOSED,['bug']
161,Pathfinder (CVS) does not compile with MonetDB 4.3.16,https://github.com/MonetDB/MonetDB/issues/236,2020-11-30T08:19:42Z,CLOSED,['bug']
162,SQL: server crash on date typecast,https://github.com/MonetDB/MonetDB/issues/237,2020-11-30T08:19:47Z,CLOSED,['bug']
163,SQL: BETWEEN in join condition crashes,https://github.com/MonetDB/MonetDB/issues/238,2020-11-30T08:19:50Z,CLOSED,['bug']
164,SQL: invalid output of single row subselect,https://github.com/MonetDB/MonetDB/issues/239,2020-11-30T08:19:53Z,CLOSED,['bug']
165,SQL: grant statement crashes server,https://github.com/MonetDB/MonetDB/issues/240,2020-11-30T08:19:56Z,CLOSED,['bug']
166,Mx @f doesn't trim string,https://github.com/MonetDB/MonetDB/issues/241,2020-11-30T08:19:59Z,CLOSED,['bug']
167,SQL: some functions require explicit cast,https://github.com/MonetDB/MonetDB/issues/244,2020-11-30T08:20:09Z,CLOSED,['bug']
168,SQL: argumentless functions not callable with (),https://github.com/MonetDB/MonetDB/issues/245,2020-11-30T08:20:12Z,CLOSED,['bug']
169,Mapi doesn't like EOLs,https://github.com/MonetDB/MonetDB/issues/247,2020-11-30T08:20:19Z,CLOSED,['bug']
170,SQL: incompatible sql admin crashes server,https://github.com/MonetDB/MonetDB/issues/248,2020-11-30T08:20:22Z,CLOSED,['bug']
171,yytree.mx name conflict with flex,https://github.com/MonetDB/MonetDB/issues/249,2020-11-30T08:20:26Z,CLOSED,['bug']
172,SQL: AND conditions crash,https://github.com/MonetDB/MonetDB/issues/251,2020-11-30T08:25:19Z,CLOSED,['bug']
173,SQL: Update on multicol-primary key,https://github.com/MonetDB/MonetDB/issues/252,2020-11-30T08:25:22Z,CLOSED,['bug']
174,ambiguous help for sort,https://github.com/MonetDB/MonetDB/issues/253,2020-11-30T08:25:24Z,CLOSED,['bug']
175,SQL: x=x+1 updates,https://github.com/MonetDB/MonetDB/issues/255,2020-11-30T08:25:30Z,CLOSED,['bug']
176,Compilation error when using --prefix=something/else,https://github.com/MonetDB/MonetDB/issues/256,2020-11-30T08:25:33Z,CLOSED,['bug']
177,SQL: INSERT...SELECT on column subset,https://github.com/MonetDB/MonetDB/issues/257,2020-11-30T08:25:35Z,CLOSED,['bug']
178,SQL: UNION queries,https://github.com/MonetDB/MonetDB/issues/258,2020-11-30T08:25:38Z,CLOSED,['bug']
179,!WARNING: CTcheck_hl: histogram disappeared!,https://github.com/MonetDB/MonetDB/issues/259,2020-11-30T08:25:41Z,CLOSED,['bug']
180,make html should create $(prefix)/doc/MonetDB,https://github.com/MonetDB/MonetDB/issues/260,2020-11-30T08:25:43Z,CLOSED,['bug']
181,.monet.conf does not work as promised.,https://github.com/MonetDB/MonetDB/issues/261,2020-11-30T08:25:46Z,CLOSED,['bug']
182,"import (ascii_io) converts ""nil"" words to nil values",https://github.com/MonetDB/MonetDB/issues/262,2020-11-30T08:25:49Z,CLOSED,['bug']
183,!WARNING: CTcheck_hl: histogram disappeared!,https://github.com/MonetDB/MonetDB/issues/264,2020-11-30T08:25:55Z,CLOSED,['bug']
184,build failure: swig/python,https://github.com/MonetDB/MonetDB/issues/265,2020-11-30T08:25:58Z,CLOSED,['bug']
185,SQL: quotes in identifiers,https://github.com/MonetDB/MonetDB/issues/267,2020-11-30T08:26:05Z,CLOSED,['bug']
186,"Mserver segfault on *""func_name""()",https://github.com/MonetDB/MonetDB/issues/269,2020-11-30T08:26:11Z,CLOSED,['bug']
187,SQL: div by zero results in ascii art,https://github.com/MonetDB/MonetDB/issues/270,2020-11-30T08:26:14Z,CLOSED,['bug']
188,kunion sets wrong seqbase when unioning consecutive ranges,https://github.com/MonetDB/MonetDB/issues/271,2020-11-30T08:26:20Z,CLOSED,['bug']
189,SQL: SQL server transforms size of character(1) columns,https://github.com/MonetDB/MonetDB/issues/272,2020-11-30T08:26:23Z,CLOSED,['bug']
190,SQL: view / alias problem,https://github.com/MonetDB/MonetDB/issues/274,2020-11-30T08:26:30Z,CLOSED,['bug']
191,"max/min(BAT[any,chr]) give wrong results on non-sorted BATs",https://github.com/MonetDB/MonetDB/issues/275,2020-11-30T08:26:33Z,CLOSED,['bug']
192,void changes to oid in leftfetchjoin with empty bats,https://github.com/MonetDB/MonetDB/issues/276,2020-11-30T08:26:36Z,CLOSED,['bug']
193,monet crashes,https://github.com/MonetDB/MonetDB/issues/277,2020-11-30T08:26:38Z,CLOSED,['bug']
194,"SQL: ""Table no output"" ???",https://github.com/MonetDB/MonetDB/issues/278,2020-11-30T08:26:41Z,CLOSED,['bug']
195,"""shutdown();"" in a non-adm client session crashes Mserver",https://github.com/MonetDB/MonetDB/issues/279,2020-11-30T08:26:44Z,CLOSED,['bug']
196,SQL: TRANSACTION SERIALIZABLE way too tight,https://github.com/MonetDB/MonetDB/issues/280,2020-11-30T08:26:47Z,CLOSED,['bug']
197,"BAT insert, conversion void-->oid: intended behavior?",https://github.com/MonetDB/MonetDB/issues/281,2020-11-30T08:26:49Z,CLOSED,['bug']
198,ERROR call doesn't get printed,https://github.com/MonetDB/MonetDB/issues/282,2020-11-30T08:26:52Z,CLOSED,['bug']
199,algebra.mx fails to compile,https://github.com/MonetDB/MonetDB/issues/283,2020-11-30T08:26:54Z,CLOSED,['bug']
200,casting Boolean to smallint fails,https://github.com/MonetDB/MonetDB/issues/284,2020-11-30T08:26:57Z,CLOSED,['bug']
201,SQL server assertion error,https://github.com/MonetDB/MonetDB/issues/285,2020-11-30T08:26:59Z,CLOSED,['bug']
202,MapiClient produces no error,https://github.com/MonetDB/MonetDB/issues/286,2020-11-30T08:27:02Z,CLOSED,['bug']
203,SQL: inappropriate auto-commit behaviour on multi-query stmt,https://github.com/MonetDB/MonetDB/issues/287,2020-11-30T08:27:04Z,CLOSED,['bug']
204,SQL: MeltDown on `simple' union query,https://github.com/MonetDB/MonetDB/issues/288,2020-11-30T08:27:07Z,CLOSED,['bug']
205,Mx does not compile with GNU on Solaris,https://github.com/MonetDB/MonetDB/issues/289,2020-11-30T08:27:10Z,CLOSED,['bug']
206,ODBC driver fails to compile on several platforms,https://github.com/MonetDB/MonetDB/issues/290,2020-11-30T08:27:13Z,CLOSED,['bug']
207,Escaped characters count double in INSERT,https://github.com/MonetDB/MonetDB/issues/291,2020-11-30T08:27:16Z,CLOSED,['bug']
208,SQL: test in src/backends/monet4/Tests fail,https://github.com/MonetDB/MonetDB/issues/292,2020-11-30T08:27:19Z,CLOSED,['bug']
209,SQL: test src/benchmarks/ATIS/Tests/select_group.sql fails,https://github.com/MonetDB/MonetDB/issues/293,2020-11-30T08:27:22Z,CLOSED,['bug']
210,SQL: test src/benchmarks/tpch/Tests/load.SQL.py fails,https://github.com/MonetDB/MonetDB/issues/294,2020-11-30T08:27:25Z,CLOSED,['bug']
211,SQL: test /src/benchmarks/wisconsin/Tests/load.sql fails,https://github.com/MonetDB/MonetDB/issues/295,2020-11-30T08:27:28Z,CLOSED,['bug']
