序号,标题,链接,创建时间,状态,标签
1986,foreign key type mismatch causes MAL stacktrace,https://github.com/MonetDB/MonetDB/issues/2745,2020-11-30T11:13:19Z,CLOSED,['bug']
1987,SPHINXCLIENT_LIBS didn't survive Sphinx move to extra,https://github.com/MonetDB/MonetDB/issues/2747,2020-11-30T11:13:24Z,CLOSED,['bug']
1988,COPY INTO does not work correctly with backslashes in VARCHARs,https://github.com/MonetDB/MonetDB/issues/2748,2020-11-30T11:13:28Z,CLOSED,['bug']
1989,Function arguments of type string described not completely in SQL catalog,https://github.com/MonetDB/MonetDB/issues/2750,2020-11-30T11:13:34Z,CLOSED,['bug']
1990,Attach test property check,https://github.com/MonetDB/MonetDB/issues/2751,2020-11-30T11:39:36Z,CLOSED,['bug']
1991,CALL function without warning,https://github.com/MonetDB/MonetDB/issues/2752,2020-11-30T11:39:39Z,CLOSED,['bug']
1992,check existence of external names for SQL functions/procedures at creation time,https://github.com/MonetDB/MonetDB/issues/2753,2020-11-30T11:39:42Z,CLOSED,['bug']
1993,segmentation fault on select query among big amount of data,https://github.com/MonetDB/MonetDB/issues/2754,2020-11-30T11:39:45Z,CLOSED,['bug']
1994,Description type inconsistancy,https://github.com/MonetDB/MonetDB/issues/2756,2020-11-30T11:39:51Z,CLOSED,['bug']
1995,ORDER BY DESC + LIMIT incorrectly yields empty result,https://github.com/MonetDB/MonetDB/issues/2757,2020-11-30T11:39:53Z,CLOSED,['bug']
1996,mserver5: ../../../src/server/rel_select.c:653 aborted,https://github.com/MonetDB/MonetDB/issues/2758,2020-11-30T11:39:57Z,CLOSED,['bug']
1997,COPY INTO fails: Could not open file,https://github.com/MonetDB/MonetDB/issues/2762,2020-11-30T11:40:09Z,CLOSED,['bug']
1998,SQL: Compute modulo of rand() in an UPDATE stmt crashes mserver5,https://github.com/MonetDB/MonetDB/issues/2766,2020-11-30T11:40:20Z,CLOSED,['bug']
1999,`make uninstall` fails in clients/rubyadapter,https://github.com/MonetDB/MonetDB/issues/2767,2020-11-30T11:40:23Z,CLOSED,['bug']
2000,"""no such column 'u.name'"" in users system view",https://github.com/MonetDB/MonetDB/issues/2768,2020-11-30T11:40:26Z,CLOSED,['bug']
2001,Column expression Table 'x' unknown: AS x LEFT JOIN ... ON x,https://github.com/MonetDB/MonetDB/issues/2769,2020-11-30T11:40:29Z,CLOSED,['bug']
2002,"libxml2 linking error during compilation, Mar2011 (Mac 10.6.6), Mar2011 branch",https://github.com/MonetDB/MonetDB/issues/2770,2020-11-30T11:40:31Z,CLOSED,['bug']
2003,correlated update query causes assertion failure,https://github.com/MonetDB/MonetDB/issues/2771,2020-11-30T11:40:35Z,CLOSED,['bug']
2004,starting database 'test'... FAILED,https://github.com/MonetDB/MonetDB/issues/2773,2020-11-30T11:40:40Z,CLOSED,['bug']
2005,COPY INTO of double (~1.0e-310) cannot be imported.,https://github.com/MonetDB/MonetDB/issues/2774,2020-11-30T11:40:43Z,CLOSED,['bug']
2006,Invalid setting of discoveryport,https://github.com/MonetDB/MonetDB/issues/2775,2020-11-30T11:40:46Z,CLOSED,['bug']
2007,server fails to start on Darwin,https://github.com/MonetDB/MonetDB/issues/2776,2020-11-30T11:40:50Z,CLOSED,['bug']
2008,RMTresolve returns an empty BAT of peers,https://github.com/MonetDB/MonetDB/issues/2777,2020-11-30T11:40:52Z,CLOSED,['bug']
2009,stream fails to compile on Solaris due to implicit alloca,https://github.com/MonetDB/MonetDB/issues/2778,2020-11-30T11:40:55Z,CLOSED,['bug']
2010,Make building GDK optional,https://github.com/MonetDB/MonetDB/issues/2779,2020-11-30T11:40:58Z,CLOSED,['bug']
2011,configure doesn't mention anything about --enable-oid32 argument,https://github.com/MonetDB/MonetDB/issues/2780,2020-11-30T11:41:00Z,CLOSED,['bug']
2012,SQL localtime() returns GMT time,https://github.com/MonetDB/MonetDB/issues/2781,2020-11-30T11:41:03Z,CLOSED,['bug']
2013,IOException error references invalid memory for filename (with patch),https://github.com/MonetDB/MonetDB/issues/2782,2020-11-30T11:41:06Z,CLOSED,['bug']
2014,configure does not (properly) check for yacc/bison,https://github.com/MonetDB/MonetDB/issues/2784,2020-11-30T11:41:12Z,CLOSED,['bug']
2015,crash when first connection is with another user than monetdb,https://github.com/MonetDB/MonetDB/issues/2786,2020-11-30T11:41:18Z,CLOSED,['bug']
2016,merovingian: internal error while starting mserver; gdk_dbfarm set to .,https://github.com/MonetDB/MonetDB/issues/2787,2020-11-30T11:41:21Z,CLOSED,['bug']
2017,stop -a complains about already stopped databases,https://github.com/MonetDB/MonetDB/issues/2788,2020-11-30T11:41:24Z,CLOSED,['bug']
2018,View returns erroneous result for squared average function as compared to query,https://github.com/MonetDB/MonetDB/issues/2790,2020-11-30T11:41:29Z,CLOSED,['bug']
2019,Problem during start of a newly created database,https://github.com/MonetDB/MonetDB/issues/2791,2020-11-30T11:41:32Z,CLOSED,['bug']
2020,"""rdfShred:RDF support is missing from MonetDB5"", although RDF support was properly configured",https://github.com/MonetDB/MonetDB/issues/2792,2020-11-30T11:41:36Z,CLOSED,['bug']
2021,EXTRACT(SECOND FROM timestamp) always returns 0 integer seconds part.,https://github.com/MonetDB/MonetDB/issues/2793,2020-11-30T11:41:39Z,CLOSED,['bug']
2022,SQL: ALTER TABLE with incorrect syntax crashes mserver5,https://github.com/MonetDB/MonetDB/issues/2795,2020-11-30T11:41:44Z,CLOSED,['bug']
2023,latest antiselect changes cause ~20 SQL tests to fail,https://github.com/MonetDB/MonetDB/issues/2796,2020-11-30T11:41:47Z,CLOSED,['bug']
2024,mserver crashes at initialization when the disk is full,https://github.com/MonetDB/MonetDB/issues/2797,2020-11-30T11:41:50Z,CLOSED,['bug']
2025,Query did not produce a result set,https://github.com/MonetDB/MonetDB/issues/2798,2020-11-30T11:41:53Z,CLOSED,['bug']
2026,MonetDb Server Crashes when creating views with many joins to other views,https://github.com/MonetDB/MonetDB/issues/2799,2020-11-30T11:41:55Z,CLOSED,['bug']
2027,Test_PStypes fails due to ambigous identifier,https://github.com/MonetDB/MonetDB/issues/2800,2020-11-30T11:41:58Z,CLOSED,['bug']
2028,Nested SELECT expression with JOIN causes outer WHERE to be disregarded sometimes,https://github.com/MonetDB/MonetDB/issues/2801,2020-11-30T11:42:01Z,CLOSED,['bug']
2029,update JDBC driver to JDBC4,https://github.com/MonetDB/MonetDB/issues/2802,2020-11-30T11:42:04Z,CLOSED,['bug']
2030,Server Crash after SWAP is full,https://github.com/MonetDB/MonetDB/issues/2803,2020-11-30T11:42:06Z,CLOSED,['bug']
2031,row_number doesn't work in complex query,https://github.com/MonetDB/MonetDB/issues/2805,2020-11-30T11:42:12Z,CLOSED,['bug']
2032,Wrong logic in predicates over views defined with an open-interval predicate,https://github.com/MonetDB/MonetDB/issues/2806,2020-11-30T11:42:15Z,CLOSED,['bug']
2033,wrong results for group by queries in the presence of primary keys,https://github.com/MonetDB/MonetDB/issues/2807,2020-11-30T11:42:17Z,CLOSED,['bug']
2034,wrong results for count()/count(distinct) on the same attribute,https://github.com/MonetDB/MonetDB/issues/2808,2020-11-30T11:42:20Z,CLOSED,['bug']
2035,Copy into should rollback correctly (i.e. restore the files) on a failure,https://github.com/MonetDB/MonetDB/issues/2810,2020-11-30T11:42:25Z,CLOSED,['bug']
2036,mserver crashes,https://github.com/MonetDB/MonetDB/issues/2811,2020-11-30T11:42:28Z,CLOSED,['bug']
2037,Subqueries in FROM clause not accepted,https://github.com/MonetDB/MonetDB/issues/2812,2020-11-30T11:42:31Z,CLOSED,['bug']
2038,SQL: catalog is built even error has occurred,https://github.com/MonetDB/MonetDB/issues/2813,2020-11-30T11:42:34Z,CLOSED,['bug']
2039,Throws exception if a SQL/GIS takes argument null,https://github.com/MonetDB/MonetDB/issues/2814,2020-11-30T11:42:36Z,CLOSED,['bug']
2040,Failed to find a table producing function,https://github.com/MonetDB/MonetDB/issues/2817,2020-11-30T11:42:45Z,CLOSED,['bug']
2041,JDBC: exception on calling Connection.setReadOnly,https://github.com/MonetDB/MonetDB/issues/2818,2020-11-30T11:42:49Z,CLOSED,['bug']
2042,make text readable,https://github.com/MonetDB/MonetDB/issues/2819,2020-11-30T11:42:52Z,CLOSED,['bug']
2043,SIGSEGV in BATins_kdiff triggered by a DELETE statement,https://github.com/MonetDB/MonetDB/issues/2820,2020-11-30T11:42:55Z,CLOSED,['bug']
2044,"segmentation fault when a select query (with group by) is run on server with ""--single-user"" option",https://github.com/MonetDB/MonetDB/issues/2821,2020-11-30T11:42:58Z,CLOSED,['bug']
2045,A query with CASE and division results in ArithmeticException,https://github.com/MonetDB/MonetDB/issues/2822,2020-11-30T11:43:01Z,CLOSED,['bug']
2046,MAL exeption on SQL query with subquery in the where part,https://github.com/MonetDB/MonetDB/issues/2823,2020-11-30T11:43:05Z,CLOSED,['bug']
2047,"""Insert into ... select distinct ..."" fails with MALException:mkey.bulk_rotate_xor_hash:operation",https://github.com/MonetDB/MonetDB/issues/2825,2020-11-30T11:43:10Z,CLOSED,['bug']
2048,sql function iterates instead of bulk processing,https://github.com/MonetDB/MonetDB/issues/2826,2020-11-30T11:43:13Z,CLOSED,['bug']
2049,Incorrect filter setting when listening to several servers,https://github.com/MonetDB/MonetDB/issues/2827,2020-11-30T11:43:16Z,CLOSED,['bug']
2050,No Socket Timeout: MonetDB Java client hangs forever on reads and consume threads when the database is crashed,https://github.com/MonetDB/MonetDB/issues/2828,2020-11-30T11:43:19Z,CLOSED,['bug']
2051,logging issue,https://github.com/MonetDB/MonetDB/issues/2829,2020-11-30T11:43:22Z,CLOSED,['bug']
2052,select 30.0 - 0.025; conversion to decimal type gives error,https://github.com/MonetDB/MonetDB/issues/2830,2020-11-30T11:43:25Z,CLOSED,['bug']
2053,Crash in query analysis,https://github.com/MonetDB/MonetDB/issues/2831,2020-11-30T11:43:28Z,CLOSED,['bug']
2054,Server terminates upon UPDATE,https://github.com/MonetDB/MonetDB/issues/2832,2020-11-30T11:43:30Z,CLOSED,['bug']
2055,NullPointerException when calling getMoreResults() on Statement without a query executed,https://github.com/MonetDB/MonetDB/issues/2833,2020-11-30T11:43:33Z,CLOSED,['bug']
2056,Prepared Statements fail after independent DDL statements (and sometimes spontaneously),https://github.com/MonetDB/MonetDB/issues/2834,2020-11-30T11:43:35Z,CLOSED,['bug']
2057,UNIQUE Constraint is not enforced,https://github.com/MonetDB/MonetDB/issues/2835,2020-11-30T11:43:38Z,CLOSED,['bug']
2058,compilation fails when --with-valgrind in effect,https://github.com/MonetDB/MonetDB/issues/2836,2020-11-30T11:43:41Z,CLOSED,['bug']
2059,Server terminates after CREATE FUNCTION in multi-user scenario,https://github.com/MonetDB/MonetDB/issues/2837,2020-11-30T11:43:44Z,CLOSED,['bug']
2060,"Nested case results in message: ""Predicate CASE 42: time to implement some more""",https://github.com/MonetDB/MonetDB/issues/2838,2020-11-30T11:43:47Z,CLOSED,['bug']
2061,test monetdb5/optimizer/Tests/inlineFunction2 fails,https://github.com/MonetDB/MonetDB/issues/2839,2020-11-30T11:43:50Z,CLOSED,['bug']
2062,Test monetdb5/optimizer/Tests/reorder01 fails,https://github.com/MonetDB/MonetDB/issues/2840,2020-11-30T11:43:53Z,CLOSED,['bug']
2063,"Tests monetdb5/optimizer/Tests/inline0{2,3,6} fail",https://github.com/MonetDB/MonetDB/issues/2841,2020-11-30T11:43:56Z,CLOSED,['bug']
2064,"Tests monetdb5/optimizer/Tests/dataflow{,3,4} lack stable output",https://github.com/MonetDB/MonetDB/issues/2842,2020-11-30T11:43:59Z,CLOSED,['bug']
2065,testing 64-bit with 32-bit OIDs crashes (on Linux & Windows),https://github.com/MonetDB/MonetDB/issues/2843,2020-11-30T11:44:02Z,CLOSED,['bug']
2066,ALTER USER SET PASSWORD doesn't recognise username,https://github.com/MonetDB/MonetDB/issues/2844,2020-11-30T11:44:04Z,CLOSED,['bug']
2067,"INSERT INTO fails (hangs) when values are derived from SELECT, in combination with a FOREIGN KEY constraint",https://github.com/MonetDB/MonetDB/issues/2845,2020-11-30T11:44:07Z,CLOSED,['bug']
2068,SELECT statement throws str_cast exception,https://github.com/MonetDB/MonetDB/issues/2847,2020-11-30T11:44:13Z,CLOSED,['bug']
2069,Problem when reusing column name as CASE... WHEN alias in subquery,https://github.com/MonetDB/MonetDB/issues/2848,2020-11-30T11:44:16Z,CLOSED,['bug']
2070,Multi-column constraints cause data corruption,https://github.com/MonetDB/MonetDB/issues/2849,2020-11-30T11:44:18Z,CLOSED,['bug']
2071,monetdbd cannot open pidfile on Fedora 15,https://github.com/MonetDB/MonetDB/issues/2850,2020-11-30T11:44:21Z,CLOSED,['bug']
2072,Incorrect error message when pidfile cannot be opened,https://github.com/MonetDB/MonetDB/issues/2851,2020-11-30T11:44:24Z,CLOSED,['bug']
2073,Query with CASE and nested functions results in very long execution,https://github.com/MonetDB/MonetDB/issues/2852,2020-11-30T11:44:27Z,CLOSED,['bug']
2074,test monetdb5/modules/mal/Tests/inspect00 fails,https://github.com/MonetDB/MonetDB/issues/2855,2020-11-30T11:44:35Z,CLOSED,['bug']
2075,test monetdb5/optimizer/Tests/dataflow fails,https://github.com/MonetDB/MonetDB/issues/2856,2020-11-30T11:44:37Z,CLOSED,['bug']
2076,obsolete conditional HAVE_LIBXML2 still used on Windows,https://github.com/MonetDB/MonetDB/issues/2857,2020-11-30T11:44:40Z,CLOSED,['bug']
2077,prepare statement tests fail with number of arguments mismatch,https://github.com/MonetDB/MonetDB/issues/2859,2020-11-30T11:44:45Z,CLOSED,['bug']
2078,/etc/init.d/monetdb5-sql uses incorrect PIDFILE to test if monetdb is running,https://github.com/MonetDB/MonetDB/issues/2860,2020-11-30T11:44:49Z,CLOSED,['bug']
2079,mclient's \d no longer returns non-system tables due to SQL AND clause,https://github.com/MonetDB/MonetDB/issues/2861,2020-11-30T11:44:51Z,CLOSED,['bug']
2080,foreign key self references cause violation upon alter table add constraint...,https://github.com/MonetDB/MonetDB/issues/2862,2020-11-30T11:44:54Z,CLOSED,['bug']
2081,crash on first connect with fresh database,https://github.com/MonetDB/MonetDB/issues/2864,2020-11-30T11:45:01Z,CLOSED,['bug']
2082,mserver5 --set gdk_nr_threads=2 --forcemito: deadlock during first SQL client connect on virgin (empty) DB,https://github.com/MonetDB/MonetDB/issues/2865,2020-11-30T11:45:03Z,CLOSED,['bug']
2083,test monetdb5/optimizer/Tests/dataflow.mal fails on all Windows & Solaris (only),https://github.com/MonetDB/MonetDB/issues/2866,2020-11-30T11:45:07Z,CLOSED,['bug']
2084,"tests remote99, smack01 & smack01-slow hang (timeout) on multi-threaded Windows",https://github.com/MonetDB/MonetDB/issues/2867,2020-11-30T11:45:10Z,CLOSED,['bug']
2085,tests tst285 & pithole fail on some Windows platforms,https://github.com/MonetDB/MonetDB/issues/2868,2020-11-30T11:45:12Z,CLOSED,['bug']
2086,"SQL tests with ""LIKE"" crash on Windows2008 & WindowsXP while working fine on Windows7",https://github.com/MonetDB/MonetDB/issues/2869,2020-11-30T11:45:15Z,CLOSED,['bug']
2087,test monetdb5/mal/Tests/pithole fails with icc on 64-bit multi-threaded Windows,https://github.com/MonetDB/MonetDB/issues/2872,2020-11-30T11:45:23Z,CLOSED,['bug']
2088,SQL: time with precision,https://github.com/MonetDB/MonetDB/issues/2873,2020-11-30T11:45:25Z,CLOSED,['bug']
2089,database conversion needed for second interval types,https://github.com/MonetDB/MonetDB/issues/2874,2020-11-30T11:45:28Z,CLOSED,['bug']
2090,incomplete database initialization,https://github.com/MonetDB/MonetDB/issues/2875,2020-11-30T11:45:31Z,CLOSED,['bug']
2091,assertion failed when creating table with default interval,https://github.com/MonetDB/MonetDB/issues/2877,2020-11-30T11:45:36Z,CLOSED,['bug']
2092,A SELECT query fails to produce some results,https://github.com/MonetDB/MonetDB/issues/2879,2020-11-30T11:45:42Z,CLOSED,['bug']
2093,Delete of some records don't work on Monetdb,https://github.com/MonetDB/MonetDB/issues/2882,2020-11-30T11:45:50Z,CLOSED,['bug']
2094,insert into t (select * from t) bogus in multithreaded execution,https://github.com/MonetDB/MonetDB/issues/2883,2020-11-30T11:45:53Z,CLOSED,['bug']
2095,Mapi.pm and GetInfo.pm syntax fixes for array usage,https://github.com/MonetDB/MonetDB/issues/2884,2020-11-30T11:45:56Z,CLOSED,['bug']
2096,DBD::monetdb table_info error,https://github.com/MonetDB/MonetDB/issues/2885,2020-11-30T11:45:59Z,CLOSED,['bug']
2097,warning: Catalog parameter '' ignored,https://github.com/MonetDB/MonetDB/issues/2886,2020-11-30T11:46:03Z,CLOSED,['bug']
2098,"Division by zero error, when should not divide at 0",https://github.com/MonetDB/MonetDB/issues/2887,2020-11-30T11:46:06Z,CLOSED,['bug']
2099,test/null/null_in_case.sql hangs server,https://github.com/MonetDB/MonetDB/issues/2888,2020-11-30T11:46:09Z,CLOSED,['bug']
2100,Mapi::getBlock is erasing query count on second call,https://github.com/MonetDB/MonetDB/issues/2889,2020-11-30T11:46:11Z,CLOSED,['bug']
2101,Slow execution of COUNT in combination with DISTINCT,https://github.com/MonetDB/MonetDB/issues/2890,2020-11-30T11:46:15Z,CLOSED,['bug']
2102,test sql/test/BugTracker-2009/Tests/rollback_bug.sql fails since recently,https://github.com/MonetDB/MonetDB/issues/2892,2020-11-30T11:46:20Z,CLOSED,['bug']
2103,No consistent behavior of implicit cast of integer to double,https://github.com/MonetDB/MonetDB/issues/2894,2020-11-30T11:46:26Z,CLOSED,['bug']
2104,"Binary bulk loads page gives a string load example, but it is not implemented",https://github.com/MonetDB/MonetDB/issues/2896,2020-11-30T11:46:31Z,CLOSED,['bug']
2105,Mapi.pm: short reads not handled when reading blocks from server,https://github.com/MonetDB/MonetDB/issues/2897,2020-11-30T11:46:33Z,CLOSED,['bug']
2106,"order by for multiple (two) columns fails for large tables when second ordering is 'desc': ""mat.refine_reverse' undefined""",https://github.com/MonetDB/MonetDB/issues/2898,2020-11-30T11:46:36Z,CLOSED,['bug']
2107,rand(int) should not return NULL,https://github.com/MonetDB/MonetDB/issues/2900,2020-11-30T11:46:41Z,CLOSED,['bug']
2108,TypeException after calling UDF in other than sys schema (when it is initialised),https://github.com/MonetDB/MonetDB/issues/2904,2020-11-30T11:46:54Z,CLOSED,['bug']
2109,Authorisation syntax incorrect,https://github.com/MonetDB/MonetDB/issues/2905,2020-11-30T11:46:57Z,CLOSED,['bug']
2110,"""ALTER TABLE mytable SET READ ONLY"" results in server segfault",https://github.com/MonetDB/MonetDB/issues/2906,2020-11-30T11:46:59Z,CLOSED,['bug']
2111,SQL query produces error with MAL statements,https://github.com/MonetDB/MonetDB/issues/2908,2020-11-30T11:47:05Z,CLOSED,['bug']
2112,query result is not displayed when history = true,https://github.com/MonetDB/MonetDB/issues/2909,2020-11-30T11:47:08Z,CLOSED,['bug']
2113,"SQLSetStmtOption(..., SQL_CONCURRENCY, SQL_CONCUR_READ_ONLY) should be allowed",https://github.com/MonetDB/MonetDB/issues/2910,2020-11-30T11:47:11Z,CLOSED,['bug']
2114,Function body disappears after loading data - error message: SQLException:sql.resultSet:Cannot access descriptor,https://github.com/MonetDB/MonetDB/issues/2912,2020-11-30T11:47:17Z,CLOSED,['bug']
2115,mserver5 crash for huge_nr_of_columns.Bug-2609 on ppc-macos,https://github.com/MonetDB/MonetDB/issues/2914,2020-11-30T11:47:23Z,CLOSED,['bug']
2116,Query  (mclient or jdbc)  with 2 outer joins appears to crash connectionor server,https://github.com/MonetDB/MonetDB/issues/2915,2020-11-30T11:47:26Z,CLOSED,['bug']
2117,non admin user cannot create temporary tables,https://github.com/MonetDB/MonetDB/issues/2916,2020-11-30T11:47:29Z,CLOSED,['bug']
2118,Add column and select in same transaction,https://github.com/MonetDB/MonetDB/issues/2919,2020-11-30T11:47:37Z,CLOSED,['bug']
2119,"Updated database from Aug2011 to Dec2011 make queries fail with ""Subquery result missing"".",https://github.com/MonetDB/MonetDB/issues/2920,2020-11-30T11:47:39Z,CLOSED,['bug']
2120,complex where clause broken,https://github.com/MonetDB/MonetDB/issues/2921,2020-11-30T11:47:42Z,CLOSED,['bug']
2121,prepare statement tests fail after changeset a9ec95c08325,https://github.com/MonetDB/MonetDB/issues/2922,2020-11-30T11:47:45Z,CLOSED,['bug']
2122,Multiplication and cast from decimal to integer leads to 0 value,https://github.com/MonetDB/MonetDB/issues/2923,2020-11-30T11:47:47Z,CLOSED,['bug']
2123,use LIKE with ESCAPE ignores OR operator,https://github.com/MonetDB/MonetDB/issues/2924,2020-11-30T11:47:50Z,CLOSED,['bug']
2124,images missing from ODBC example,https://github.com/MonetDB/MonetDB/issues/2926,2020-11-30T11:47:55Z,CLOSED,['bug']
2125,Tutorial instructions are slightly wrong / out of date,https://github.com/MonetDB/MonetDB/issues/2927,2020-11-30T11:47:58Z,CLOSED,['bug']
2126,Cannot update a field with a count query based on an other table,https://github.com/MonetDB/MonetDB/issues/2928,2020-11-30T11:48:00Z,CLOSED,['bug']
2127,Very large number operations give strange results,https://github.com/MonetDB/MonetDB/issues/2929,2020-11-30T11:48:03Z,CLOSED,['bug']
2128,"""TypeException: algebra.join undefined"" when evaluating EXISTS (SELECT ...) predicate",https://github.com/MonetDB/MonetDB/issues/2933,2020-11-30T11:48:16Z,CLOSED,['bug']
2129,Database upgrade with SQL catalog upgrade messes up privileges,https://github.com/MonetDB/MonetDB/issues/2934,2020-11-30T11:48:18Z,CLOSED,['bug']
2130,mserver5 doesn't detect memory on Solaris/Sparc,https://github.com/MonetDB/MonetDB/issues/2935,2020-11-30T11:48:21Z,CLOSED,['bug']
2131,bug into mapi_ping(),https://github.com/MonetDB/MonetDB/issues/2936,2020-11-30T11:48:23Z,CLOSED,['bug']
2132,minor bug into monetdb_insert_id()  (php_monetdb.php),https://github.com/MonetDB/MonetDB/issues/2937,2020-11-30T11:48:26Z,CLOSED,['bug']
2133,minor bug into auto_commit() (php_monetdb.php),https://github.com/MonetDB/MonetDB/issues/2938,2020-11-30T11:48:28Z,CLOSED,['bug']
2134,"""PHP Notice"" in mapi_execute()",https://github.com/MonetDB/MonetDB/issues/2939,2020-11-30T11:48:31Z,CLOSED,['bug']
2135,PHP split() function deprecated,https://github.com/MonetDB/MonetDB/issues/2940,2020-11-30T11:48:33Z,CLOSED,['bug']
2136,Maven coordinates for MonetDB JDBC driver,https://github.com/MonetDB/MonetDB/issues/2943,2020-11-30T11:48:41Z,CLOSED,['bug']
2137,stethoscope on can't connect to database without monetdbd (discovery enabled),https://github.com/MonetDB/MonetDB/issues/2944,2020-11-30T11:48:44Z,CLOSED,['bug']
2138,Invalid BAT if left join condition has only columns from right table,https://github.com/MonetDB/MonetDB/issues/2946,2020-11-30T11:48:50Z,CLOSED,['bug']
2139,"Queries where a ""is null"" clause is combined with two equals clauses fail to produce the expected result.",https://github.com/MonetDB/MonetDB/issues/2947,2020-11-30T11:48:52Z,CLOSED,['bug']
2140,SQL exception during execution of a correct user defined function that just returns a relation table constructed by a simple SQL select query,https://github.com/MonetDB/MonetDB/issues/2949,2020-11-30T11:48:58Z,CLOSED,['bug']
2141,MonetResultSet use of SimpleDateFormat not threadsafe,https://github.com/MonetDB/MonetDB/issues/2950,2020-11-30T11:49:01Z,CLOSED,['bug']
2142,wrong results when using group by on large dataset,https://github.com/MonetDB/MonetDB/issues/2951,2020-11-30T11:49:04Z,CLOSED,['bug']
2143,utf-8 characters in long string,https://github.com/MonetDB/MonetDB/issues/2952,2020-11-30T11:49:08Z,CLOSED,['bug']
2144,segfault for monetdb get with invalid property,https://github.com/MonetDB/MonetDB/issues/2953,2020-11-30T11:49:11Z,CLOSED,['bug']
2145,stethoscope errors are confusion,https://github.com/MonetDB/MonetDB/issues/2955,2020-11-30T11:49:16Z,CLOSED,['bug']
2146,Startup of MonetDB fails with segmentationfault,https://github.com/MonetDB/MonetDB/issues/2957,2020-11-30T11:49:22Z,CLOSED,['bug']
2147,Grant does't work with schema syntax,https://github.com/MonetDB/MonetDB/issues/2958,2020-11-30T11:49:25Z,CLOSED,['bug']
2148,Nested SELECT with EXISTS causes the server to crash,https://github.com/MonetDB/MonetDB/issues/2959,2020-11-30T11:49:27Z,CLOSED,['bug']
2149,mclient terminates connection during insertion of a large number of records from a file,https://github.com/MonetDB/MonetDB/issues/2960,2020-11-30T11:49:30Z,CLOSED,['bug']
2150,client timezone information needs to be handled also for modifications to timestamp values,https://github.com/MonetDB/MonetDB/issues/2962,2020-11-30T11:49:36Z,CLOSED,['bug']
2151,"invalid tuple received from server, got 17 columns, expected 24, ignoring",https://github.com/MonetDB/MonetDB/issues/2963,2020-11-30T11:49:39Z,CLOSED,['bug']
2152,LEFT OUTER JOIN with constants returns errors,https://github.com/MonetDB/MonetDB/issues/2964,2020-11-30T11:49:43Z,CLOSED,['bug']
2153,joinPath runs indeterminately,https://github.com/MonetDB/MonetDB/issues/2965,2020-11-30T11:49:46Z,CLOSED,['bug']
2154,copy into documentation missing OFFSET count.,https://github.com/MonetDB/MonetDB/issues/2967,2020-11-30T11:49:51Z,CLOSED,['bug']
2155,Memory Leaks,https://github.com/MonetDB/MonetDB/issues/2968,2020-11-30T11:49:54Z,CLOSED,['bug']
2156,Result precision issue with Decimal data type,https://github.com/MonetDB/MonetDB/issues/2969,2020-11-30T11:49:56Z,CLOSED,['bug']
2157,MALException:mkey.bulk_rotate_xor_hash:operation failed Operands not synced on head (on altertable add unique),https://github.com/MonetDB/MonetDB/issues/2971,2020-11-30T11:50:02Z,CLOSED,['bug']
2158,SQL URL functionality contains errors,https://github.com/MonetDB/MonetDB/issues/2972,2020-11-30T11:50:05Z,CLOSED,['bug']
2159,Date coercion functionality tests,https://github.com/MonetDB/MonetDB/issues/2973,2020-11-30T11:50:08Z,CLOSED,['bug']
2160,thetajoin produces invalid/inconsistent bat,https://github.com/MonetDB/MonetDB/issues/2974,2020-11-30T11:50:11Z,CLOSED,['bug']
2161,CSV file is kept write-locked after mclient failed to COPY,https://github.com/MonetDB/MonetDB/issues/2975,2020-11-30T11:50:14Z,CLOSED,['bug']
2162,timestamp minus date results in program error,https://github.com/MonetDB/MonetDB/issues/2977,2020-11-30T11:50:20Z,CLOSED,['bug']
