序号,标题,链接,创建时间,状态,标签
1015,PF: StandOff tests fail since 2007.03.13,https://github.com/MonetDB/MonetDB/issues/1314,2020-11-30T09:32:43Z,CLOSED,['bug']
1016,PF: test fails on assert_order() since 2007.03.31,https://github.com/MonetDB/MonetDB/issues/1315,2020-11-30T09:32:47Z,CLOSED,['bug']
1017,PF: tests/W3C_use_cases/XQ/XMP/Q04alg fails since 2007.04.03,https://github.com/MonetDB/MonetDB/issues/1316,2020-11-30T09:32:49Z,CLOSED,['bug']
1018,PF: test fails since 2007.04.03,https://github.com/MonetDB/MonetDB/issues/1317,2020-11-30T09:32:51Z,CLOSED,['bug']
1019,PF: various tests fail since 2007.04.04,https://github.com/MonetDB/MonetDB/issues/1318,2020-11-30T09:32:54Z,CLOSED,['bug']
1020,PF: prop. err. in update tests since 2007.04.26 (64-bit OIDs,https://github.com/MonetDB/MonetDB/issues/1319,2020-11-30T09:32:56Z,CLOSED,['bug']
1021,PF: several tests fail since 2007.04.28,https://github.com/MonetDB/MonetDB/issues/1320,2020-11-30T09:32:59Z,CLOSED,['bug']
1022,PF: several tests fail since 2007.05.03,https://github.com/MonetDB/MonetDB/issues/1321,2020-11-30T09:33:01Z,CLOSED,['bug']
1023,PF: various tests fail since 2007.05.04,https://github.com/MonetDB/MonetDB/issues/1322,2020-11-30T09:33:04Z,CLOSED,['bug']
1024,Mix-up in nested element construction,https://github.com/MonetDB/MonetDB/issues/1323,2020-11-30T09:33:07Z,CLOSED,['bug']
1025,Error mposjoin: missing matches,https://github.com/MonetDB/MonetDB/issues/1324,2020-11-30T09:33:09Z,CLOSED,['bug']
1026,delete on committed dense persistent BAT causes prop. error,https://github.com/MonetDB/MonetDB/issues/1325,2020-11-30T09:33:12Z,CLOSED,['bug']
1027,"PFtijah: hard-wired ""/tmp/TIJAH_LOGGER"" not portable",https://github.com/MonetDB/MonetDB/issues/1326,2020-11-30T09:33:14Z,CLOSED,['bug']
1028,"PFtijah: ""/tmp/TIJAH_LOGGER"" never cleaned => fills /tmp/ !",https://github.com/MonetDB/MonetDB/issues/1327,2020-11-30T09:33:17Z,CLOSED,['bug']
1029,PF/runtime: find_qn_bulk() adds new qnames twice,https://github.com/MonetDB/MonetDB/issues/1328,2020-11-30T09:33:19Z,CLOSED,['bug']
1030,XQuery/XRPC: refresh admin-page causes segmentation fault,https://github.com/MonetDB/MonetDB/issues/1329,2020-11-30T09:33:21Z,CLOSED,['bug']
1031,PF: XRpc tests fail on MacOS (Darwin) since 2007-03-10,https://github.com/MonetDB/MonetDB/issues/1330,2020-11-30T09:33:24Z,CLOSED,['bug']
1032,Infinite loop....,https://github.com/MonetDB/MonetDB/issues/1331,2020-11-30T09:33:27Z,CLOSED,['bug']
1033,SQL: View creation using a function....,https://github.com/MonetDB/MonetDB/issues/1332,2020-11-30T09:33:30Z,CLOSED,['bug']
1034,SQL: CHECK CONSTRAINT...,https://github.com/MonetDB/MonetDB/issues/1333,2020-11-30T09:33:33Z,CLOSED,['bug']
1035,Set default value.....,https://github.com/MonetDB/MonetDB/issues/1334,2020-11-30T09:33:35Z,CLOSED,['bug']
1036,LIKE for time values...,https://github.com/MonetDB/MonetDB/issues/1336,2020-11-30T09:33:40Z,CLOSED,['bug']
1037,Temporary tables....,https://github.com/MonetDB/MonetDB/issues/1337,2020-11-30T09:33:43Z,CLOSED,['bug']
1038,LOCAL AND GLOBAL temporary table,https://github.com/MonetDB/MonetDB/issues/1338,2020-11-30T09:33:45Z,CLOSED,['bug']
1039,CREATE TABLE WITH DATA...,https://github.com/MonetDB/MonetDB/issues/1339,2020-11-30T09:33:48Z,CLOSED,['bug']
1040,PF: compiler/algebra/opt/opt_thetajoin.c icc-compil. fails,https://github.com/MonetDB/MonetDB/issues/1340,2020-11-30T09:33:51Z,CLOSED,['bug']
1041,PF: put() to /tmp crashes Mserver,https://github.com/MonetDB/MonetDB/issues/1341,2020-11-30T09:33:53Z,CLOSED,['bug']
1042,SQL: decimal handling errors,https://github.com/MonetDB/MonetDB/issues/1342,2020-11-30T09:33:56Z,CLOSED,['bug']
1043,"PF: strange behaviour of ""rename""",https://github.com/MonetDB/MonetDB/issues/1343,2020-11-30T09:33:59Z,CLOSED,['bug']
1044,PF: node's sibling not accessable after deletion of the node,https://github.com/MonetDB/MonetDB/issues/1344,2020-11-30T09:34:01Z,CLOSED,['bug']
1045,PF: select deleted node results in error,https://github.com/MonetDB/MonetDB/issues/1345,2020-11-30T09:34:04Z,CLOSED,['bug']
1046,PF: new loop-lifted following step still buggy?,https://github.com/MonetDB/MonetDB/issues/1346,2020-11-30T09:34:07Z,CLOSED,['bug']
1047,WITH queries works only once!,https://github.com/MonetDB/MonetDB/issues/1347,2020-11-30T09:34:09Z,CLOSED,['bug']
1048,Bind Variable with CAST function Crashes Server - CRITICAL,https://github.com/MonetDB/MonetDB/issues/1348,2020-11-30T09:34:12Z,CLOSED,['bug']
1049,"PF: ""!ERROR: Division by zero"" after latest checkins",https://github.com/MonetDB/MonetDB/issues/1349,2020-11-30T09:34:15Z,CLOSED,['bug']
1050,PF: WebSite tests books[123] fail since 2007.05.03,https://github.com/MonetDB/MonetDB/issues/1350,2020-11-30T09:34:17Z,CLOSED,['bug']
1051,PF: tests/W3C_use_cases/XQUF/R/Q4 err-msg changed on May 18,https://github.com/MonetDB/MonetDB/issues/1351,2020-11-30T09:34:19Z,CLOSED,['bug']
1052,PF: compiler/sql/lalg2sql.brg fails to compile w/o assertion,https://github.com/MonetDB/MonetDB/issues/1352,2020-11-30T09:34:22Z,CLOSED,['bug']
1053,rand() is not executed for every row,https://github.com/MonetDB/MonetDB/issues/1353,2020-11-30T09:34:25Z,CLOSED,['bug']
1054,SQL Query Crashes Server - CRITICAL,https://github.com/MonetDB/MonetDB/issues/1354,2020-11-30T09:34:27Z,CLOSED,['bug']
1055,XQuery compiler warning treated as error,https://github.com/MonetDB/MonetDB/issues/1355,2020-11-30T09:34:30Z,CLOSED,['bug']
1056,PF: coreopt optimization eats all available memory and swap,https://github.com/MonetDB/MonetDB/issues/1356,2020-11-30T09:34:33Z,CLOSED,['bug']
1057,SQL: mixing auto-commit with explicit transactions,https://github.com/MonetDB/MonetDB/issues/1357,2020-11-30T09:34:35Z,CLOSED,['bug']
1058,"monetdb helper uses ""ps"" arguments unsupported on Mac",https://github.com/MonetDB/MonetDB/issues/1358,2020-11-30T09:34:38Z,CLOSED,['bug']
1059,XQuery: Error while using 'order by',https://github.com/MonetDB/MonetDB/issues/1359,2020-11-30T09:34:41Z,CLOSED,['bug']
1060,Cannot connect to MonetDB via ODBC from PowerBuilderâ€,https://github.com/MonetDB/MonetDB/issues/1360,2020-11-30T09:34:43Z,CLOSED,['bug']
1061,large COPY INTO with primary key,https://github.com/MonetDB/MonetDB/issues/1361,2020-11-30T09:34:46Z,CLOSED,['bug']
1062,PFtijah: failing alloc() causes assertion failure (segfault),https://github.com/MonetDB/MonetDB/issues/1362,2020-11-30T09:34:49Z,CLOSED,['bug']
1063,SQL: Segmentation fault with query.,https://github.com/MonetDB/MonetDB/issues/1363,2020-11-30T09:34:52Z,CLOSED,['bug']
1064,XQuery: Administrative Console,https://github.com/MonetDB/MonetDB/issues/1364,2020-11-30T09:34:55Z,CLOSED,['bug']
1065,XQuery: collection management broken,https://github.com/MonetDB/MonetDB/issues/1365,2020-11-30T09:34:57Z,CLOSED,['bug']
1066,XQuery: Attribute access causes mposjoin error,https://github.com/MonetDB/MonetDB/issues/1366,2020-11-30T09:35:00Z,CLOSED,['bug']
1067,XQuery: inserting (large) doc into other doc,https://github.com/MonetDB/MonetDB/issues/1367,2020-11-30T09:35:02Z,CLOSED,['bug']
1068,M5: Assertion crash on simple return,https://github.com/MonetDB/MonetDB/issues/1368,2020-11-30T09:35:05Z,CLOSED,['bug']
1069,stream.mx: assertion fails on Solaris 10/x86,https://github.com/MonetDB/MonetDB/issues/1369,2020-11-30T09:35:08Z,CLOSED,['bug']
1070,Solaris 10/Sparc: weird crashes on external library usage,https://github.com/MonetDB/MonetDB/issues/1370,2020-11-30T09:35:11Z,CLOSED,['bug']
1071,main windows download broken (please move back to 4.16.0),https://github.com/MonetDB/MonetDB/issues/1371,2020-11-30T09:35:14Z,CLOSED,['bug']
1072,XQ: Mserver crashes on concatenated query,https://github.com/MonetDB/MonetDB/issues/1372,2020-11-30T09:35:17Z,CLOSED,['bug']
1073,XQ/JDBC: 250 results,https://github.com/MonetDB/MonetDB/issues/1373,2020-11-30T09:35:19Z,CLOSED,['bug']
1074,XQ: 32 docs,https://github.com/MonetDB/MonetDB/issues/1374,2020-11-30T09:35:21Z,CLOSED,['bug']
1075,cast of expression hangs,https://github.com/MonetDB/MonetDB/issues/1375,2020-11-30T09:35:24Z,CLOSED,['bug']
1076,XQ: wrong numeric cast in general comparison,https://github.com/MonetDB/MonetDB/issues/1376,2020-11-30T09:35:27Z,CLOSED,['bug']
1077,Error in preceding axis,https://github.com/MonetDB/MonetDB/issues/1377,2020-11-30T09:35:30Z,CLOSED,['bug']
1078,SQL: most test in src/test/Update_Delete_action fail,https://github.com/MonetDB/MonetDB/issues/1378,2020-11-30T09:35:32Z,CLOSED,['bug']
1079,PFtijah tests fail on Itanium,https://github.com/MonetDB/MonetDB/issues/1379,2020-11-30T09:35:35Z,CLOSED,['bug']
1080,PF: xrpc_server fails to compile with icc,https://github.com/MonetDB/MonetDB/issues/1380,2020-11-30T09:35:38Z,CLOSED,['bug']
1081,SQL: test MapiClient-dump.SF-905851 fails,https://github.com/MonetDB/MonetDB/issues/1381,2020-11-30T09:35:40Z,CLOSED,['bug']
1082,Update pKey with the same value for different rows...,https://github.com/MonetDB/MonetDB/issues/1382,2020-11-30T09:35:43Z,CLOSED,['bug']
1083,Update fkey with a values not in the pkey...,https://github.com/MonetDB/MonetDB/issues/1384,2020-11-30T09:35:49Z,CLOSED,['bug']
1084,clients RPM requires user monetdb,https://github.com/MonetDB/MonetDB/issues/1385,2020-11-30T09:35:51Z,CLOSED,['bug']
1085,Alter table to add Fkey....,https://github.com/MonetDB/MonetDB/issues/1386,2020-11-30T09:35:54Z,CLOSED,['bug']
1086,admin console images missing,https://github.com/MonetDB/MonetDB/issues/1387,2020-11-30T09:35:56Z,CLOSED,['bug']
1087,128MB RAM needed to compile '1'?,https://github.com/MonetDB/MonetDB/issues/1388,2020-11-30T09:35:59Z,CLOSED,['bug']
1088,select id not in another select...,https://github.com/MonetDB/MonetDB/issues/1389,2020-11-30T09:36:02Z,CLOSED,['bug']
1089,EXPLAIN support from JDBC,https://github.com/MonetDB/MonetDB/issues/1390,2020-11-30T09:36:05Z,CLOSED,['bug']
1090,"TRACE,PROFILE,DEBUG should be impossible for JDBC and ODBC",https://github.com/MonetDB/MonetDB/issues/1391,2020-11-30T09:36:07Z,CLOSED,['bug']
1091,PF: live-variable-limit-handling in mil_opt.c buggy,https://github.com/MonetDB/MonetDB/issues/1392,2020-11-30T09:36:10Z,CLOSED,['bug']
1092,M5: test remote00.py times out since 2007/06/12,https://github.com/MonetDB/MonetDB/issues/1393,2020-11-30T09:36:13Z,CLOSED,['bug']
1093,PF: ws_create inconsistently adds a collection node,https://github.com/MonetDB/MonetDB/issues/1394,2020-11-30T09:36:16Z,CLOSED,['bug']
1094,SQL/5: tests fail since 2007/06/22 on some platforms,https://github.com/MonetDB/MonetDB/issues/1395,2020-11-30T09:36:18Z,CLOSED,['bug']
1095,SQL: some JDBC tests fail since 2007/06/04 on some platforms,https://github.com/MonetDB/MonetDB/issues/1396,2020-11-30T09:36:21Z,CLOSED,['bug']
1096,XQ: problem with ampersand in attribute value,https://github.com/MonetDB/MonetDB/issues/1397,2020-11-30T09:36:24Z,CLOSED,['bug']
1097,XQ: illegal XML syntax in serialized attributes,https://github.com/MonetDB/MonetDB/issues/1398,2020-11-30T09:36:27Z,CLOSED,['bug']
1098,M5: tests tst654 & tst655 fail since 2007.06.25,https://github.com/MonetDB/MonetDB/issues/1400,2020-11-30T09:36:32Z,CLOSED,['bug']
1099,M5: test tst670 fails since 2007.06.29,https://github.com/MonetDB/MonetDB/issues/1401,2020-11-30T09:36:34Z,CLOSED,['bug']
1100,XQ: admin console images not installed,https://github.com/MonetDB/MonetDB/issues/1402,2020-11-30T09:36:37Z,CLOSED,['bug']
1101,XQ: merged_union error with fn:sum(),https://github.com/MonetDB/MonetDB/issues/1405,2020-11-30T09:36:44Z,CLOSED,['bug']
1102,NullPointerException in MonetConnection,https://github.com/MonetDB/MonetDB/issues/1406,2020-11-30T09:36:47Z,CLOSED,['bug']
1103,XQ: printing special characters in comment nodes,https://github.com/MonetDB/MonetDB/issues/1407,2020-11-30T09:36:49Z,CLOSED,['bug']
1104,SQL: Prepared statement type mismatch,https://github.com/MonetDB/MonetDB/issues/1409,2020-11-30T09:36:55Z,CLOSED,['bug']
1105,XQUF replace function seems to corrupt the database,https://github.com/MonetDB/MonetDB/issues/1410,2020-11-30T09:36:57Z,CLOSED,['bug']
1106,Mil optimizer bug,https://github.com/MonetDB/MonetDB/issues/1411,2020-11-30T09:37:00Z,CLOSED,['bug']
1107,SQL5: tests fails since 2007/07/02,https://github.com/MonetDB/MonetDB/issues/1412,2020-11-30T09:37:03Z,CLOSED,['bug']
1108,PF: wrong use of leftfetchjoin causes segfault in bat_cast,https://github.com/MonetDB/MonetDB/issues/1413,2020-11-30T09:37:06Z,CLOSED,['bug']
1109,PF: test attribute_access_mposjoin_error.SF-1726928 fails,https://github.com/MonetDB/MonetDB/issues/1414,2020-11-30T09:37:10Z,CLOSED,['bug']
1110,PF: semantics tests fail since 2007/07/04,https://github.com/MonetDB/MonetDB/issues/1416,2020-11-30T09:37:15Z,CLOSED,['bug']
1111,PF/alg: test attribute_value_comparison.SF-1576463.alg fails,https://github.com/MonetDB/MonetDB/issues/1417,2020-11-30T09:37:18Z,CLOSED,['bug']
1112,Pathfinder fails to compile,https://github.com/MonetDB/MonetDB/issues/1418,2020-11-30T09:37:20Z,CLOSED,['bug']
1113,XQ: illegal offsets in swizzle,https://github.com/MonetDB/MonetDB/issues/1419,2020-11-30T09:37:23Z,CLOSED,['bug']
1114,XQ: illegal offsets in swizzle (2),https://github.com/MonetDB/MonetDB/issues/1420,2020-11-30T09:37:26Z,CLOSED,['bug']
1115,XQ: insert attribute gives ERROR in merged_union,https://github.com/MonetDB/MonetDB/issues/1421,2020-11-30T09:37:29Z,CLOSED,['bug']
1116,API:Incomplete block read from stream (Mserver still alive?),https://github.com/MonetDB/MonetDB/issues/1423,2020-11-30T09:37:34Z,CLOSED,['bug']
1117,Double for / position / subsequence bug,https://github.com/MonetDB/MonetDB/issues/1424,2020-11-30T09:37:37Z,CLOSED,['bug']
1118,XQ: monetdb immune for updates,https://github.com/MonetDB/MonetDB/issues/1425,2020-11-30T09:37:39Z,CLOSED,['bug']
1119,XQ: third pf-add into collection fails,https://github.com/MonetDB/MonetDB/issues/1426,2020-11-30T09:37:43Z,CLOSED,['bug']
1120,PF: runtime/serialize_dflt.mx fails to compile with icc,https://github.com/MonetDB/MonetDB/issues/1427,2020-11-30T09:37:45Z,CLOSED,['bug']
1121,M5: src/optimizer/opt_partitions.mx fails to compile w/ gcc,https://github.com/MonetDB/MonetDB/issues/1428,2020-11-30T09:37:48Z,CLOSED,['bug']
1122,M5: src/modules/mal/bpm.mx fails to compile w/ icc,https://github.com/MonetDB/MonetDB/issues/1429,2020-11-30T09:37:51Z,CLOSED,['bug']
1123,MIL-optimizer fails sometimes for big queries,https://github.com/MonetDB/MonetDB/issues/1430,2020-11-30T09:37:53Z,CLOSED,['bug']
1124,SQL: order by timestampz column with limit crash,https://github.com/MonetDB/MonetDB/issues/1431,2020-11-30T09:37:56Z,CLOSED,['bug']
1125,SQL: conversion from decimal to varchar error,https://github.com/MonetDB/MonetDB/issues/1432,2020-11-30T09:37:59Z,CLOSED,['bug']
1126,Single page manual damaged,https://github.com/MonetDB/MonetDB/issues/1433,2020-11-30T09:38:01Z,CLOSED,['bug']
1127,SQL: implied conversion from numeric to varchar disconnect,https://github.com/MonetDB/MonetDB/issues/1434,2020-11-30T09:38:04Z,CLOSED,['bug']
1128,compilation of onetDB5/src/modules/mal/mat.mx fails on icc,https://github.com/MonetDB/MonetDB/issues/1435,2020-11-30T09:38:07Z,CLOSED,['bug']
1129,XQ: SAX serialization not working properly,https://github.com/MonetDB/MonetDB/issues/1436,2020-11-30T09:38:10Z,CLOSED,['bug']
1130,"SQL+PF: loading both ""sql_server"" and ""pathfinder"" fails",https://github.com/MonetDB/MonetDB/issues/1437,2020-11-30T09:38:12Z,CLOSED,['bug']
1131,M5: unable to compile on Solaris/Sparc,https://github.com/MonetDB/MonetDB/issues/1439,2020-11-30T09:38:17Z,CLOSED,['bug']
1132,SQL: parser warnings,https://github.com/MonetDB/MonetDB/issues/1440,2020-11-30T09:38:20Z,CLOSED,['bug']
1133,"MonetDB compilation error ""__init__.py""",https://github.com/MonetDB/MonetDB/issues/1441,2020-11-30T09:38:22Z,CLOSED,['bug']
1134,Java compilation errors when compiling clients module,https://github.com/MonetDB/MonetDB/issues/1442,2020-11-30T09:38:25Z,CLOSED,['bug']
1135,XQ:Crash while updating XML,https://github.com/MonetDB/MonetDB/issues/1443,2020-11-30T09:38:28Z,CLOSED,['bug']
1136,SQL: hangs/crashes on 'exists' subqueries after a join,https://github.com/MonetDB/MonetDB/issues/1444,2020-11-30T09:38:31Z,CLOSED,['bug']
1137,SQL: compilation fails on Darwin,https://github.com/MonetDB/MonetDB/issues/1445,2020-11-30T09:38:34Z,CLOSED,['bug']
1138,M5: 2 tests run worse than with previous release,https://github.com/MonetDB/MonetDB/issues/1446,2020-11-30T09:38:37Z,CLOSED,['bug']
1139,SQL: various tests run worse than with previous release,https://github.com/MonetDB/MonetDB/issues/1447,2020-11-30T09:38:40Z,CLOSED,['bug']
1140,PF: various tests run worse than with previous release,https://github.com/MonetDB/MonetDB/issues/1448,2020-11-30T09:38:42Z,CLOSED,['bug']
1141,Mtest.py error: 'LINUX_DIST' is not defined,https://github.com/MonetDB/MonetDB/issues/1449,2020-11-30T09:38:44Z,CLOSED,['bug']
1142,Compiling pathfinder (Stable) failed on all platforms,https://github.com/MonetDB/MonetDB/issues/1450,2020-11-30T09:38:47Z,CLOSED,['bug']
1143,Compiling sql (Current) failed on GNU.32.32.d-Darwin8.10.0,https://github.com/MonetDB/MonetDB/issues/1451,2020-11-30T09:38:50Z,CLOSED,['bug']
1144,make rpm in clients fails,https://github.com/MonetDB/MonetDB/issues/1453,2020-11-30T09:38:55Z,CLOSED,['bug']
1145,Compiling pathfinder (Stable) failed on Fedora/CentOS,https://github.com/MonetDB/MonetDB/issues/1454,2020-11-30T09:38:58Z,CLOSED,['bug']
1146,`mclient -lmal` crashes on empty line on stdin,https://github.com/MonetDB/MonetDB/issues/1456,2020-11-30T09:39:04Z,CLOSED,['bug']
1147,SQL: prepare output has unqualified table_name header,https://github.com/MonetDB/MonetDB/issues/1457,2020-11-30T09:39:07Z,CLOSED,['bug']
1148,clients: compilation MapiClient.mx failed,https://github.com/MonetDB/MonetDB/issues/1458,2020-11-30T09:39:10Z,CLOSED,['bug']
1149,PF: compilation of pfshred fails,https://github.com/MonetDB/MonetDB/issues/1460,2020-11-30T09:39:15Z,CLOSED,['bug']
1150,"[ADT] Adding large document, with update support",https://github.com/MonetDB/MonetDB/issues/1461,2020-11-30T09:39:18Z,CLOSED,['bug']
1151,M5: distribution tarballs contain non-sense data,https://github.com/MonetDB/MonetDB/issues/1462,2020-11-30T09:39:21Z,CLOSED,['bug']
1152,PF: 24 tests fail after recent checkins,https://github.com/MonetDB/MonetDB/issues/1463,2020-11-30T09:39:24Z,CLOSED,['bug']
1153,Python Client problems,https://github.com/MonetDB/MonetDB/issues/1464,2020-11-30T09:39:27Z,CLOSED,['bug']
1154,xq: Repeated insert fails (CMDdelete_bat_bun: operation fai),https://github.com/MonetDB/MonetDB/issues/1465,2020-11-30T09:39:30Z,CLOSED,['bug']
1155,sql/src/test/mapi/python_dbapi test fails,https://github.com/MonetDB/MonetDB/issues/1467,2020-11-30T09:39:35Z,CLOSED,['bug']
1156,PF/probxml: Memory corruption in MXQ 0.20,https://github.com/MonetDB/MonetDB/issues/1468,2020-11-30T09:39:37Z,CLOSED,['bug']
1157,SQL: python_dbapi_embedded test bound to fail in TestWeb,https://github.com/MonetDB/MonetDB/issues/1469,2020-11-30T09:39:40Z,CLOSED,['bug']
1158,Cascade operations in different sessions...,https://github.com/MonetDB/MonetDB/issues/1471,2020-11-30T09:39:44Z,CLOSED,['bug']
1159,PF: compilation fails with Intel's icc,https://github.com/MonetDB/MonetDB/issues/1472,2020-11-30T09:39:47Z,CLOSED,['bug']
1160,PF: loading module pathfinder fails,https://github.com/MonetDB/MonetDB/issues/1473,2020-11-30T09:39:50Z,CLOSED,['bug']
1161,SQL/4: tests segfault due to uninitialized variable,https://github.com/MonetDB/MonetDB/issues/1474,2020-11-30T09:39:52Z,CLOSED,['bug']
1162,"Merovingian: cannot start out of the box, as dbfarm doesn't",https://github.com/MonetDB/MonetDB/issues/1476,2020-11-30T09:39:57Z,CLOSED,['bug']
1163,--enable-bits doesn't work with icc,https://github.com/MonetDB/MonetDB/issues/1478,2020-11-30T09:40:02Z,CLOSED,['bug']
1164,make failed on MonetDB5,https://github.com/MonetDB/MonetDB/issues/1479,2020-11-30T09:40:05Z,CLOSED,['bug']
1165,XQ:normalize-space does not remove leading/trailing space,https://github.com/MonetDB/MonetDB/issues/1480,2020-11-30T09:40:08Z,CLOSED,['bug']
1166,"gcc 4.1/4.2 produces wrong code on FC6, F8 & RHEL4WS",https://github.com/MonetDB/MonetDB/issues/1481,2020-11-30T09:40:10Z,CLOSED,['bug']
1167,Clients: Debian gcj/ant doesn't work.,https://github.com/MonetDB/MonetDB/issues/1482,2020-11-30T09:40:14Z,CLOSED,['bug']
1168,"Decimal / NUMERIC (9,2) won't allow initial NULL value",https://github.com/MonetDB/MonetDB/issues/1483,2020-11-30T09:40:17Z,CLOSED,['bug']
1169,Python errors not getting passed through MAPI,https://github.com/MonetDB/MonetDB/issues/1484,2020-11-30T09:40:19Z,CLOSED,['bug']
1170,Compiling clients (Stable) failed on GNU.32.32.d-Gentoo1.12.,https://github.com/MonetDB/MonetDB/issues/1485,2020-11-30T09:40:22Z,CLOSED,['bug']
1171,Compiling pathfinder (Stable) failed on GNU.32.32.d-Fedora8,https://github.com/MonetDB/MonetDB/issues/1486,2020-11-30T09:40:24Z,CLOSED,['bug']
1172,cursor.executemany (python) fails,https://github.com/MonetDB/MonetDB/issues/1487,2020-11-30T09:40:27Z,CLOSED,['bug']
1173,M4+M5: mmap fails on f8,https://github.com/MonetDB/MonetDB/issues/1488,2020-11-30T09:40:30Z,CLOSED,['bug']
1174,XQ: compilation fails on various platforms,https://github.com/MonetDB/MonetDB/issues/1489,2020-11-30T09:40:32Z,CLOSED,['bug']
1175,XQ: Error with declared variable in module,https://github.com/MonetDB/MonetDB/issues/1491,2020-11-30T09:40:37Z,CLOSED,['bug']
1176,gdk: umask(0000); kind of bad for security,https://github.com/MonetDB/MonetDB/issues/1492,2020-11-30T09:40:40Z,CLOSED,['bug']
1177,column with date type,https://github.com/MonetDB/MonetDB/issues/1493,2020-11-30T09:40:42Z,CLOSED,['bug']
1178,SQL: select 5 % 3 crashes,https://github.com/MonetDB/MonetDB/issues/1494,2020-11-30T09:40:45Z,CLOSED,['bug']
1179,SQL: can't use variable name staring with _digit in SQL func,https://github.com/MonetDB/MonetDB/issues/1495,2020-11-30T09:40:47Z,CLOSED,['bug']
1180,BAT capacity checking needed,https://github.com/MonetDB/MonetDB/issues/1496,2020-11-30T09:40:50Z,CLOSED,['bug']
1181,"converters.py missing ""bigint"":long",https://github.com/MonetDB/MonetDB/issues/1497,2020-11-30T09:40:53Z,CLOSED,['bug']
1182,Timestamp column won't accept insert without time,https://github.com/MonetDB/MonetDB/issues/1498,2020-11-30T09:40:55Z,CLOSED,['bug']
1183,select with coalesce,https://github.com/MonetDB/MonetDB/issues/1501,2020-11-30T09:43:56Z,CLOSED,['bug']
1184,preceding-sibling failure,https://github.com/MonetDB/MonetDB/issues/1502,2020-11-30T09:43:58Z,CLOSED,['bug']
1185,creation of exeception for select crash...,https://github.com/MonetDB/MonetDB/issues/1503,2020-11-30T09:44:01Z,CLOSED,['bug']
1186,select with full join...,https://github.com/MonetDB/MonetDB/issues/1504,2020-11-30T09:44:04Z,CLOSED,['bug']
1187,insert text with repeat...,https://github.com/MonetDB/MonetDB/issues/1505,2020-11-30T09:44:07Z,CLOSED,['bug']
1188,LIMIT / OFFSET support still broken,https://github.com/MonetDB/MonetDB/issues/1506,2020-11-30T09:44:10Z,CLOSED,['bug']
1189,BULK load failing for NUMERIC columns,https://github.com/MonetDB/MonetDB/issues/1507,2020-11-30T09:44:12Z,CLOSED,['bug']
1190,Better error reports on bulk load (include line num)...,https://github.com/MonetDB/MonetDB/issues/1508,2020-11-30T09:44:15Z,CLOSED,['bug']
1191,nightly builds: make geom and java repos available,https://github.com/MonetDB/MonetDB/issues/1509,2020-11-30T09:44:18Z,CLOSED,['bug']
1192,Set a new user password...,https://github.com/MonetDB/MonetDB/issues/1510,2020-11-30T09:44:20Z,CLOSED,['bug']
1193,Python converters don't quote unicode strings...,https://github.com/MonetDB/MonetDB/issues/1511,2020-11-30T09:44:23Z,CLOSED,['bug']
1194,Java: nl/cwi/monetdb/util/NamespaceContextImpl.java,https://github.com/MonetDB/MonetDB/issues/1512,2020-11-30T09:44:26Z,CLOSED,['bug']
1195,Merovingian: successful exit when port is already in use,https://github.com/MonetDB/MonetDB/issues/1513,2020-11-30T09:44:28Z,CLOSED,['bug']
1196,clients: Debian doesn't have strcasecmp,https://github.com/MonetDB/MonetDB/issues/1514,2020-11-30T09:44:30Z,CLOSED,['bug']
1197,"`make rpm` fails for all packages (""Current"")",https://github.com/MonetDB/MonetDB/issues/1515,2020-11-30T09:44:33Z,CLOSED,['bug']
1198,Java fails to compile,https://github.com/MonetDB/MonetDB/issues/1517,2020-11-30T09:44:38Z,CLOSED,['bug']
1199,difference function crashes,https://github.com/MonetDB/MonetDB/issues/1518,2020-11-30T09:44:40Z,CLOSED,['bug']
1200,octet_length...,https://github.com/MonetDB/MonetDB/issues/1519,2020-11-30T09:44:43Z,CLOSED,['bug']
1201,select insert....,https://github.com/MonetDB/MonetDB/issues/1520,2020-11-30T09:44:45Z,CLOSED,['bug']
1202,select sign...,https://github.com/MonetDB/MonetDB/issues/1521,2020-11-30T09:44:48Z,CLOSED,['bug']
1203,select crashes in the optimization,https://github.com/MonetDB/MonetDB/issues/1522,2020-11-30T09:44:51Z,CLOSED,['bug']
1204,"monetdb {start,stop,kill} -a doesn't work",https://github.com/MonetDB/MonetDB/issues/1523,2020-11-30T09:44:53Z,CLOSED,['bug']
1205,Windows: plain `(n)make` does not extract .m[ia]l from .mx,https://github.com/MonetDB/MonetDB/issues/1524,2020-11-30T09:44:56Z,CLOSED,['bug']
1206,XQ: [preceding and following]-sibling:: bug,https://github.com/MonetDB/MonetDB/issues/1526,2020-11-30T09:45:02Z,CLOSED,['bug']
1207,alter column to set the same constraint,https://github.com/MonetDB/MonetDB/issues/1527,2020-11-30T09:45:05Z,CLOSED,['bug']
1208,add and then drop the same constraint...,https://github.com/MonetDB/MonetDB/issues/1528,2020-11-30T09:45:09Z,CLOSED,['bug']
1209,create the same temp table after its drop...,https://github.com/MonetDB/MonetDB/issues/1529,2020-11-30T09:45:12Z,CLOSED,['bug']
1210,remap in src/modules/plain/Tests/bat.py fails on Win64,https://github.com/MonetDB/MonetDB/issues/1530,2020-11-30T09:45:14Z,CLOSED,['bug']
