序号,标题,链接,创建时间,状态,标签
3033,wrong count values (1 instead of 0) for correlated aggregation queries,https://github.com/MonetDB/MonetDB/issues/6257,2020-11-30T15:45:07Z,CLOSED,['bug']
3034,Vulnerability in FITS and NETCDF data vaults,https://github.com/MonetDB/MonetDB/issues/6258,2020-11-30T15:45:10Z,CLOSED,['bug']
3035,crash on select query from sqlitelogictests,https://github.com/MonetDB/MonetDB/issues/6259,2020-11-30T15:45:13Z,CLOSED,['bug']
3036,Sqlitelogictest crash,https://github.com/MonetDB/MonetDB/issues/6260,2020-11-30T15:45:18Z,CLOSED,['bug']
3037,New handling of delta tables hurts badly reusage of bats,https://github.com/MonetDB/MonetDB/issues/6261,2020-11-30T15:45:21Z,CLOSED,['bug']
3038,should the CORR function return some numeric type that allows fractions?,https://github.com/MonetDB/MonetDB/issues/6287,2020-11-30T15:46:46Z,CLOSED,['bug']
3039,Function cannot find column in merge table,https://github.com/MonetDB/MonetDB/issues/6288,2020-11-30T15:46:49Z,CLOSED,['bug']
3040,Crashes and hangs with remote tables,https://github.com/MonetDB/MonetDB/issues/6289,2020-11-30T15:46:52Z,CLOSED,['bug']
3041,Crash (and assertion failure) with a correlated subquery with NOT IN in the select-list,https://github.com/MonetDB/MonetDB/issues/6290,2020-11-30T15:46:56Z,CLOSED,['bug']
3042,crash if executes a function with sample operator,https://github.com/MonetDB/MonetDB/issues/6291,2020-11-30T15:46:59Z,CLOSED,['bug']
3043,Runaway SQL optimizer in too many nested operators,https://github.com/MonetDB/MonetDB/issues/6292,2020-11-30T15:47:03Z,CLOSED,['bug']
3044,Sqlitelogictest crash,https://github.com/MonetDB/MonetDB/issues/6294,2020-11-30T15:47:09Z,CLOSED,['bug']
3045,msqldump writes unescaped timestamp values when using inserts,https://github.com/MonetDB/MonetDB/issues/6295,2020-11-30T15:47:12Z,CLOSED,['bug']
3046,Another sqllitelogictest crash :(,https://github.com/MonetDB/MonetDB/issues/6296,2020-11-30T15:47:15Z,CLOSED,['bug']
3047,7th sqllitelogictest crash :(,https://github.com/MonetDB/MonetDB/issues/6297,2020-11-30T15:47:18Z,CLOSED,['bug']
3048,Protect against missing BATs (sqlsmith),https://github.com/MonetDB/MonetDB/issues/6300,2020-11-30T15:47:29Z,CLOSED,['bug']
3049,MonetDBLite-Java embedded API ArrayIndexOutOfBoundsException,https://github.com/MonetDB/MonetDB/issues/6301,2020-11-30T15:47:32Z,CLOSED,['bug']
3050,Name resolution error (sqlsmith),https://github.com/MonetDB/MonetDB/issues/6310,2020-11-30T15:47:56Z,CLOSED,['bug']
3051,Object not found in LIMIT clause (sqlsmith),https://github.com/MonetDB/MonetDB/issues/6312,2020-11-30T15:48:02Z,CLOSED,['bug']
3052,Null type resolution in disjunction fails (sqlsmith),https://github.com/MonetDB/MonetDB/issues/6313,2020-11-30T15:48:06Z,CLOSED,['bug']
3053,Lateral crash report (sqlsmith),https://github.com/MonetDB/MonetDB/issues/6314,2020-11-30T15:48:09Z,CLOSED,['bug']
3054,Exist operator on type bigint missing (sqlsmith),https://github.com/MonetDB/MonetDB/issues/6315,2020-11-30T15:48:12Z,CLOSED,['bug']
3055,Coalesc and limit error (sqlsmith),https://github.com/MonetDB/MonetDB/issues/6316,2020-11-30T15:48:16Z,CLOSED,['bug']
3056,Two-column integer aggregation extremely slow,https://github.com/MonetDB/MonetDB/issues/6317,2020-11-30T15:48:19Z,CLOSED,['bug']
3057,Daemon crashes if .merovignian_properties for a database contains more than 42 entries,https://github.com/MonetDB/MonetDB/issues/6318,2020-11-30T15:48:22Z,CLOSED,['bug']
3058,Server crash on LATERAL (sqlsmith),https://github.com/MonetDB/MonetDB/issues/6319,2020-11-30T15:48:25Z,CLOSED,['bug']
3059,The daemon ignores all but the last entry in the .merovignian_properties file when spawning mserver5,https://github.com/MonetDB/MonetDB/issues/6320,2020-11-30T15:48:28Z,CLOSED,['bug']
3060,Two-column aggregation on join result extremely slow.,https://github.com/MonetDB/MonetDB/issues/6321,2020-11-30T15:48:31Z,CLOSED,['bug']
3061,Crash on disjunction with LIMIT (sqlsmith),https://github.com/MonetDB/MonetDB/issues/6322,2020-11-30T15:48:35Z,CLOSED,['bug']
3062,Deadlock calling sys.bbp(),https://github.com/MonetDB/MonetDB/issues/6323,2020-11-30T15:48:37Z,CLOSED,['bug']
3063,Sqlitelogictest crash in a IN query (8th),https://github.com/MonetDB/MonetDB/issues/6324,2020-11-30T15:48:41Z,CLOSED,['bug']
3064,Merge table unusable in other connections,https://github.com/MonetDB/MonetDB/issues/6325,2020-11-30T15:48:43Z,CLOSED,['bug']
3065,The daemon does not respect the actual name of the mserver5 executable,https://github.com/MonetDB/MonetDB/issues/6327,2020-11-30T15:48:50Z,CLOSED,['bug']
3066,Transactional/multi-connection issues with merge tables,https://github.com/MonetDB/MonetDB/issues/6328,2020-11-30T15:48:53Z,CLOSED,['bug']
3067,Sqlitelogictest crash on a complex SELECT query,https://github.com/MonetDB/MonetDB/issues/6330,2020-11-30T15:49:00Z,CLOSED,['bug']
3068,"sys.statistics column ""nils"" always contains 0. Expected a positive value for columns that have one or more nils/NULLs",https://github.com/MonetDB/MonetDB/issues/6331,2020-11-30T15:49:03Z,CLOSED,['bug']
3069,Sqlitelogictest crash related to an undefined MAL function,https://github.com/MonetDB/MonetDB/issues/6332,2020-11-30T15:49:06Z,CLOSED,['bug']
3070,Sqlitelogictest crash in complex SQL query,https://github.com/MonetDB/MonetDB/issues/6335,2020-11-30T15:49:16Z,CLOSED,['bug']
3071,VALUES multiple inserts error,https://github.com/MonetDB/MonetDB/issues/6336,2020-11-30T15:49:20Z,CLOSED,['bug']
3072,SQL raises assert in relbin_groupby,https://github.com/MonetDB/MonetDB/issues/6338,2020-11-30T15:49:25Z,CLOSED,['bug']
3073,Mserver5 crashes on nested SELECT,https://github.com/MonetDB/MonetDB/issues/6339,2020-11-30T15:49:29Z,CLOSED,['bug']
3074,"sample operator takes effect after the execution of the query, expected before",https://github.com/MonetDB/MonetDB/issues/6340,2020-11-30T15:49:31Z,CLOSED,['bug']
3075,MERGE TABLE issue: Cannot register,https://github.com/MonetDB/MonetDB/issues/6341,2020-11-30T15:49:35Z,CLOSED,['bug']
3076,MERGE TABLE issue: hang,https://github.com/MonetDB/MonetDB/issues/6342,2020-11-30T15:49:38Z,CLOSED,['bug']
3077,MERGE TABLE issue: unable to find,https://github.com/MonetDB/MonetDB/issues/6343,2020-11-30T15:49:41Z,CLOSED,['bug']
3078,Spurious errors and assertions (SQLsmith),https://github.com/MonetDB/MonetDB/issues/6344,2020-11-30T15:49:44Z,CLOSED,['bug']
3079,BATsort returns GDK_SUCCEED when **sorted bat is null,https://github.com/MonetDB/MonetDB/issues/6346,2020-11-30T15:49:51Z,CLOSED,['bug']
3080,"Mserver returns with ""memory exhausted in"" error if query size exceeds 2.5MB",https://github.com/MonetDB/MonetDB/issues/6347,2020-11-30T15:49:55Z,CLOSED,['bug']
3081,Interference of procedure/table name,https://github.com/MonetDB/MonetDB/issues/6348,2020-11-30T15:49:58Z,CLOSED,['bug']
3082,Cannot set String value to a CLOB column in MonetPreparedStatement,https://github.com/MonetDB/MonetDB/issues/6349,2020-11-30T15:50:01Z,CLOSED,['bug']
3083,Carriage return and form feed in TEXT fields are returned as 'r' and 'f' in jdbcclient and ResultSets,https://github.com/MonetDB/MonetDB/issues/6350,2020-11-30T15:50:05Z,CLOSED,['bug']
3084,Scope resolution problem (sqlsmith),https://github.com/MonetDB/MonetDB/issues/6352,2020-11-30T15:50:11Z,CLOSED,['bug']
3085,implicit NULL value not propagated in distributed/remote query,https://github.com/MonetDB/MonetDB/issues/6353,2020-11-30T15:50:14Z,CLOSED,['bug']
3086,Wrong answer from merge table after content changes,https://github.com/MonetDB/MonetDB/issues/6374,2020-11-30T15:51:11Z,CLOSED,['bug']
3087,MAL profiler truncates JSON objects larger than 8192 characters,https://github.com/MonetDB/MonetDB/issues/6375,2020-11-30T15:51:14Z,CLOSED,['bug']
3088,MonetDB.org Blogs RSS feed truncated?,https://github.com/MonetDB/MonetDB/issues/6377,2020-11-30T15:51:21Z,CLOSED,['bug']
3089,Table UDF: cannot mix range variables and scalar variables,https://github.com/MonetDB/MonetDB/issues/6378,2020-11-30T15:51:24Z,CLOSED,['bug']
3090,Table UDF: SEGV raised when invoking a non existing function,https://github.com/MonetDB/MonetDB/issues/6379,2020-11-30T15:51:28Z,CLOSED,['bug']
3091,unable to create new databases from clean installation,https://github.com/MonetDB/MonetDB/issues/6380,2020-11-30T15:51:31Z,CLOSED,['bug']
3092,Parser misses error messages in conditional,https://github.com/MonetDB/MonetDB/issues/6381,2020-11-30T15:51:34Z,CLOSED,['bug']
3093,Can't set JSON fields via PreparedStatement,https://github.com/MonetDB/MonetDB/issues/6382,2020-11-30T15:51:38Z,CLOSED,['bug']
3094,Debian apt failling to install,https://github.com/MonetDB/MonetDB/issues/6383,2020-11-30T15:51:41Z,CLOSED,['bug']
3095,crash when setting a wrong listenaddr,https://github.com/MonetDB/MonetDB/issues/6384,2020-11-30T15:51:44Z,CLOSED,['bug']
3096,AGGREGATE UDFs with more than 2 parameters incorrectly processed,https://github.com/MonetDB/MonetDB/issues/6385,2020-11-30T15:51:48Z,CLOSED,['bug']
3097,Unexpected error from server for query with long floats,https://github.com/MonetDB/MonetDB/issues/6386,2020-11-30T15:51:51Z,CLOSED,['bug']
3098,Performance degradation on multi column sort,https://github.com/MonetDB/MonetDB/issues/6387,2020-11-30T15:51:55Z,CLOSED,['bug']
3099,JDBC Connection via user voc produces errors when fetching certain meta data information,https://github.com/MonetDB/MonetDB/issues/6388,2020-11-30T15:51:58Z,CLOSED,['bug']
3100,SELECT EXISTS (empty table) returns 'true',https://github.com/MonetDB/MonetDB/issues/6392,2020-11-30T15:52:10Z,CLOSED,['bug']
3101,BAT leak of scalar result sets,https://github.com/MonetDB/MonetDB/issues/6395,2020-11-30T15:52:18Z,CLOSED,['bug']
3102,Isolation of generating functions not correct,https://github.com/MonetDB/MonetDB/issues/6397,2020-11-30T15:52:23Z,CLOSED,['bug']
3103,Null Matches in outer join are not supported,https://github.com/MonetDB/MonetDB/issues/6398,2020-11-30T15:52:25Z,CLOSED,['bug']
3104,UDF crashes when subquery and scalar values are passed as pameters,https://github.com/MonetDB/MonetDB/issues/6399,2020-11-30T15:52:28Z,CLOSED,['bug']
3105,getCharacterStream() currently not supported,https://github.com/MonetDB/MonetDB/issues/6400,2020-11-30T15:52:31Z,CLOSED,['bug']
3106,Suspected memory leak in mserver5 when creating/dropping tables,https://github.com/MonetDB/MonetDB/issues/6401,2020-11-30T15:52:33Z,CLOSED,['bug']
3107,COPY INTO crashes if table has primary key or foreign key constraint,https://github.com/MonetDB/MonetDB/issues/6404,2020-11-30T15:52:42Z,CLOSED,['bug']
3108,Compilation error if DISABLE_PARENT_HASH not defined,https://github.com/MonetDB/MonetDB/issues/6405,2020-11-30T15:52:45Z,CLOSED,['bug']
3109,looping monetdb create release start stop destroy a couple of times hangs on stop or start,https://github.com/MonetDB/MonetDB/issues/6407,2020-11-30T15:52:52Z,CLOSED,['bug']
3110,sqllogictest crash on aggregation query with NOT IN clause in HAVING clause,https://github.com/MonetDB/MonetDB/issues/6409,2020-11-30T15:52:58Z,CLOSED,['bug']
3111,Sqlitelogictest crash on aggregation query with IN clause,https://github.com/MonetDB/MonetDB/issues/6410,2020-11-30T15:53:02Z,CLOSED,['bug']
3112,Sqlitelogictest crash in aggregation query,https://github.com/MonetDB/MonetDB/issues/6411,2020-11-30T15:53:06Z,CLOSED,['bug']
3113,Overflow in sys.epoch,https://github.com/MonetDB/MonetDB/issues/6412,2020-11-30T15:53:08Z,CLOSED,['bug']
3114,Wrong answer for TPC-H Q17,https://github.com/MonetDB/MonetDB/issues/6413,2020-11-30T15:53:11Z,CLOSED,['bug']
3115,Using RPAD returns: could not allocate space,https://github.com/MonetDB/MonetDB/issues/6414,2020-11-30T15:53:13Z,CLOSED,['bug']
3116,Date arithmetic types are inconsistent,https://github.com/MonetDB/MonetDB/issues/6415,2020-11-30T15:53:16Z,CLOSED,['bug']
3117,Sqlitelogictest crash in aggregation query with a NOT IN clause,https://github.com/MonetDB/MonetDB/issues/6416,2020-11-30T15:53:20Z,CLOSED,['bug']
3118,Segfault encountered (sqlsmith),https://github.com/MonetDB/MonetDB/issues/6417,2020-11-30T15:53:23Z,CLOSED,['bug']
3119,Segfault in renaming (sqlsmith),https://github.com/MonetDB/MonetDB/issues/6418,2020-11-30T15:53:27Z,CLOSED,['bug']
3120,segfault in rel_optimizer (sqlsmith),https://github.com/MonetDB/MonetDB/issues/6419,2020-11-30T15:53:30Z,CLOSED,['bug']
3121,Assertion error in mergetable task (sqlsmith),https://github.com/MonetDB/MonetDB/issues/6420,2020-11-30T15:53:33Z,CLOSED,['bug']
3122,Another assertion error in rel_or (sqlsmith),https://github.com/MonetDB/MonetDB/issues/6422,2020-11-30T15:53:39Z,CLOSED,['bug']
3123,Dereference null pointer (sqlsmith),https://github.com/MonetDB/MonetDB/issues/6423,2020-11-30T15:53:42Z,CLOSED,['bug']
3124,Assertion error in rel_rename_expr (sqlsmith),https://github.com/MonetDB/MonetDB/issues/6424,2020-11-30T15:53:45Z,CLOSED,['bug']
3125,Assertion error in exp_bin (sqlsmith),https://github.com/MonetDB/MonetDB/issues/6425,2020-11-30T15:53:48Z,CLOSED,['bug']
3126,Assertion error in rel_find_exp_ (sqlsmith),https://github.com/MonetDB/MonetDB/issues/6426,2020-11-30T15:53:52Z,CLOSED,['bug']
3127,Assertion error in eq_typeswitchloop (sqlsmith),https://github.com/MonetDB/MonetDB/issues/6427,2020-11-30T15:53:56Z,CLOSED,['bug']
3128,Sqlitelogictest crash in aggregation query,https://github.com/MonetDB/MonetDB/issues/6428,2020-11-30T15:53:58Z,CLOSED,['bug']
3129,ROUND produces wrong data type,https://github.com/MonetDB/MonetDB/issues/6429,2020-11-30T15:54:01Z,CLOSED,['bug']
3130,Assertion raised in another eq_typeswitch error (sqlsmith),https://github.com/MonetDB/MonetDB/issues/6430,2020-11-30T15:54:04Z,CLOSED,['bug']
3131,Sqlitelogictest crash in aggregation query with a long having clause,https://github.com/MonetDB/MonetDB/issues/6431,2020-11-30T15:54:07Z,CLOSED,['bug']
3132,Assertion error in exp_bin (sqlsmith),https://github.com/MonetDB/MonetDB/issues/6432,2020-11-30T15:54:11Z,CLOSED,['bug']
3133,Sqlitelogictest crash in complex SELECT query with IN operator,https://github.com/MonetDB/MonetDB/issues/6433,2020-11-30T15:54:14Z,CLOSED,['bug']
3134,Sqlitelogictest crash in simple select query,https://github.com/MonetDB/MonetDB/issues/6435,2020-11-30T15:54:20Z,CLOSED,['bug']
3135,Query sequence with 2x ifthenelse() and next nullif() causes mserver5 Segmentation fault,https://github.com/MonetDB/MonetDB/issues/6436,2020-11-30T15:54:24Z,CLOSED,['bug']
3136,"System schemas ""profiler"" and ""json"" shouldn't be allowed to be dropped.",https://github.com/MonetDB/MonetDB/issues/6437,2020-11-30T15:54:28Z,CLOSED,['bug']
3137,Implement functionality to enforce the restrict option in: DROP SCHEMA xyz RESTRICT;,https://github.com/MonetDB/MonetDB/issues/6438,2020-11-30T15:54:31Z,CLOSED,['bug']
3138,Invalid references to sys.columns.id from sys.statistics.column_id,https://github.com/MonetDB/MonetDB/issues/6439,2020-11-30T15:54:34Z,CLOSED,['bug']
3139,Faulty plan generated. Query returns more rows than expected or existing in the view sys.tables.,https://github.com/MonetDB/MonetDB/issues/6440,2020-11-30T15:54:38Z,CLOSED,['bug']
3140,SEGFAULT with COPY INTO BEST EFFORT and skipping input columns,https://github.com/MonetDB/MonetDB/issues/6442,2020-11-30T15:54:46Z,CLOSED,['bug']
3141,complex(?) query forgets(?) column name,https://github.com/MonetDB/MonetDB/issues/6443,2020-11-30T15:54:50Z,CLOSED,['bug']
3142,Using 'with' keyword with table returning function crashes monetdb,https://github.com/MonetDB/MonetDB/issues/6444,2020-11-30T15:54:53Z,CLOSED,['bug']
3143,Sqlitelogictest crash in MySQL query,https://github.com/MonetDB/MonetDB/issues/6445,2020-11-30T15:54:56Z,CLOSED,['bug']
3144,sql_parser.y bug?,https://github.com/MonetDB/MonetDB/issues/6446,2020-11-30T15:55:00Z,CLOSED,['bug']
3145,'insert into' with multiple rows containing subqueries crashes,https://github.com/MonetDB/MonetDB/issues/6448,2020-11-30T15:55:07Z,CLOSED,['bug']
3146,Assertion error in rel_dce_refs (sqlsmith),https://github.com/MonetDB/MonetDB/issues/6449,2020-11-30T15:55:10Z,CLOSED,['bug']
3147,Assertion error in exp_bin (sqlsmith),https://github.com/MonetDB/MonetDB/issues/6450,2020-11-30T15:55:13Z,CLOSED,['bug']
3148,Assertion error in sql_ref_dec (sqlsmith),https://github.com/MonetDB/MonetDB/issues/6451,2020-11-30T15:55:15Z,CLOSED,['bug']
3149,Mclient hangs when mserver raises a FATAL error,https://github.com/MonetDB/MonetDB/issues/6452,2020-11-30T15:55:18Z,CLOSED,['bug']
3150,Assertion error  in rel_rename_exps (sqlsmith),https://github.com/MonetDB/MonetDB/issues/6453,2020-11-30T15:55:21Z,CLOSED,['bug']
3151,SQL lexical error,https://github.com/MonetDB/MonetDB/issues/6454,2020-11-30T15:55:24Z,CLOSED,['bug']
3152,Assertion error in rel_apply_rewrite (sqlsmith),https://github.com/MonetDB/MonetDB/issues/6455,2020-11-30T15:55:27Z,CLOSED,['bug']
3153,NULL becomes 0 in outer join,https://github.com/MonetDB/MonetDB/issues/6456,2020-11-30T15:55:29Z,CLOSED,['bug']
3154,Floating-point sum aggregation out of memory,https://github.com/MonetDB/MonetDB/issues/6458,2020-11-30T15:55:35Z,CLOSED,['bug']
3155,Assertion error in exp_bin (sqlsmith),https://github.com/MonetDB/MonetDB/issues/6459,2020-11-30T15:55:39Z,CLOSED,['bug']
3156,selinux doen't allow mmap,https://github.com/MonetDB/MonetDB/issues/6460,2020-11-30T15:55:41Z,CLOSED,['bug']
3157,Dumping python and R UDFs,https://github.com/MonetDB/MonetDB/issues/6461,2020-11-30T15:55:44Z,CLOSED,['bug']
3158,large virtual memory spike on BLOB column select,https://github.com/MonetDB/MonetDB/issues/6462,2020-11-30T15:55:47Z,CLOSED,['bug']
3159,appending to variables sized atom bats other than str bats with force flag may result in corrupted heap,https://github.com/MonetDB/MonetDB/issues/6465,2020-11-30T15:55:55Z,CLOSED,['bug']
3160,date_to_str formatter is wrong,https://github.com/MonetDB/MonetDB/issues/6467,2020-11-30T15:56:01Z,CLOSED,['bug']
3161,JDBC 2.27 fails with year < 1000,https://github.com/MonetDB/MonetDB/issues/6468,2020-11-30T15:56:05Z,CLOSED,['bug']
3162,Monetdb crashes,https://github.com/MonetDB/MonetDB/issues/6469,2020-11-30T15:56:09Z,CLOSED,['bug']
3163,mitosis gets in the way of simple select,https://github.com/MonetDB/MonetDB/issues/6470,2020-11-30T15:56:13Z,CLOSED,['bug']
3164,calls to sys.generate_series should auto-convert arguments,https://github.com/MonetDB/MonetDB/issues/6471,2020-11-30T15:56:17Z,CLOSED,['bug']
3165,Assertion failure in rel_rename (Sqlsmith),https://github.com/MonetDB/MonetDB/issues/6472,2020-11-30T15:56:20Z,CLOSED,['bug']
3166,Assertion error in exp_bin (sqlsmith),https://github.com/MonetDB/MonetDB/issues/6474,2020-11-30T15:56:26Z,CLOSED,['bug']
3167,assertion eror rel_push_project_up (sqlsmith),https://github.com/MonetDB/MonetDB/issues/6477,2020-11-30T15:56:34Z,CLOSED,['bug']
3168,Crash with nested order by/ limit offset,https://github.com/MonetDB/MonetDB/issues/6478,2020-11-30T15:56:37Z,CLOSED,['bug']
3169,Mserver receives an assertion error on a procedure call,https://github.com/MonetDB/MonetDB/issues/6479,2020-11-30T15:56:40Z,CLOSED,['bug']
3170,Segfault in mvc_find_subexp (sqlsmith),https://github.com/MonetDB/MonetDB/issues/6480,2020-11-30T15:56:43Z,CLOSED,['bug']
3171,COUNT DISTINCT or SUM DISTINCT causing slowness,https://github.com/MonetDB/MonetDB/issues/6481,2020-11-30T15:56:46Z,CLOSED,['bug']
3172,Query failures on order by on union,https://github.com/MonetDB/MonetDB/issues/6482,2020-11-30T15:56:50Z,CLOSED,['bug']
3173,"Monetdb crashes, on query",https://github.com/MonetDB/MonetDB/issues/6483,2020-11-30T15:56:53Z,CLOSED,['bug']
3174,Monetdb crashes  on order by after union,https://github.com/MonetDB/MonetDB/issues/6485,2020-11-30T15:57:00Z,CLOSED,['bug']
3175,UNION of NULLs with several tables fails,https://github.com/MonetDB/MonetDB/issues/6487,2020-11-30T15:57:08Z,CLOSED,['bug']
3176,Semijoin returns duplicate values from a column with unique values,https://github.com/MonetDB/MonetDB/issues/6488,2020-11-30T15:57:11Z,CLOSED,['bug']
3177,Sqlitelogictest - Wrong result set of complex conditional query,https://github.com/MonetDB/MonetDB/issues/6489,2020-11-30T15:57:14Z,CLOSED,['bug']
3178,Sqlitelogictest - Select query with an IN clause parse error,https://github.com/MonetDB/MonetDB/issues/6490,2020-11-30T15:57:18Z,CLOSED,['bug']
3179,SELECT IN returns NULL instead of false when not found,https://github.com/MonetDB/MonetDB/issues/6491,2020-11-30T15:57:22Z,CLOSED,['bug']
3180,Persistent hashes stored and then ignored. Storage info not in sync with actual indices.,https://github.com/MonetDB/MonetDB/issues/6492,2020-11-30T15:57:25Z,CLOSED,['bug']
3181,Sqlitelogictest - Aggregation query on empty table with DISTINCT clause,https://github.com/MonetDB/MonetDB/issues/6493,2020-11-30T15:57:29Z,CLOSED,['bug']
3182,Sqlitelogictest - Algebra operators priority in select query,https://github.com/MonetDB/MonetDB/issues/6494,2020-11-30T15:57:33Z,CLOSED,['bug']
3183,Sqlitelogictest - Omitting AS in a result set column alias name,https://github.com/MonetDB/MonetDB/issues/6495,2020-11-30T15:57:36Z,CLOSED,['bug']
3184,Sqlitelogictest - Select interval comparisons between floating-points and NULL,https://github.com/MonetDB/MonetDB/issues/6496,2020-11-30T15:57:38Z,CLOSED,['bug']
3185,Sqlitelogictest - Select not between query producing wrong results,https://github.com/MonetDB/MonetDB/issues/6497,2020-11-30T15:57:41Z,CLOSED,['bug']
3186,large virtual memory spike on BLOB column COUNT,https://github.com/MonetDB/MonetDB/issues/6498,2020-11-30T15:57:44Z,CLOSED,['bug']
3187,Crash when trying to replace a function defined in sys from a different schema,https://github.com/MonetDB/MonetDB/issues/6499,2020-11-30T15:57:48Z,CLOSED,['bug']
3188,SELECT: too many nested operators,https://github.com/MonetDB/MonetDB/issues/6500,2020-11-30T15:57:51Z,CLOSED,['bug']
3189,MAL debugger example not executable,https://github.com/MonetDB/MonetDB/issues/6501,2020-11-30T16:22:54Z,CLOSED,['bug']
3190,Query with multiple limit clauses does not return anything,https://github.com/MonetDB/MonetDB/issues/6502,2020-11-30T16:22:58Z,CLOSED,['bug']
3191,Improper performance counters,https://github.com/MonetDB/MonetDB/issues/6506,2020-11-30T16:23:10Z,CLOSED,['bug']
3192,Column Header coming with trailing spaces in compiled version of MonetDB 11.27.9/11,https://github.com/MonetDB/MonetDB/issues/6507,2020-11-30T16:23:13Z,CLOSED,['bug']
3193,"Segmentation fault in mserver5 on Python2 UDF with TIMESTAMP column input that has NULL values (conversion.c:438, PyNullMask_FromBAT)",https://github.com/MonetDB/MonetDB/issues/6508,2020-11-30T16:23:16Z,CLOSED,['bug']
3194,Sqlitelogictest: Wrong output in aggregation query,https://github.com/MonetDB/MonetDB/issues/6510,2020-11-30T16:23:22Z,CLOSED,['bug']
3195,Sqlitelogictest: Wrong output in select query with not between query,https://github.com/MonetDB/MonetDB/issues/6511,2020-11-30T16:23:25Z,CLOSED,['bug']
3196,Monetdb crashes on query with limit after sort with case,https://github.com/MonetDB/MonetDB/issues/6512,2020-11-30T16:23:28Z,CLOSED,['bug']
3197,Sqlitelogictest: Wrong MAL plan generation for column product,https://github.com/MonetDB/MonetDB/issues/6513,2020-11-30T16:23:31Z,CLOSED,['bug']
3198,Sqlitelogictest: Range query between NULL values not possible,https://github.com/MonetDB/MonetDB/issues/6514,2020-11-30T16:23:34Z,CLOSED,['bug']
3199,Insert null second interval value results in 0,https://github.com/MonetDB/MonetDB/issues/6515,2020-11-30T16:23:37Z,CLOSED,['bug']
3200,Sqlitelogictest unknown bat append operation,https://github.com/MonetDB/MonetDB/issues/6516,2020-11-30T16:23:39Z,CLOSED,['bug']
3201,Sqlitelogictest overflow in conversion during MAL plan execution,https://github.com/MonetDB/MonetDB/issues/6517,2020-11-30T16:23:43Z,CLOSED,['bug']
3202,Sqlitelogictest: count aggregation with not in operator,https://github.com/MonetDB/MonetDB/issues/6518,2020-11-30T16:23:45Z,CLOSED,['bug']
3203,Sqlitelogictest: algebra join between lng and int BATs undefined,https://github.com/MonetDB/MonetDB/issues/6519,2020-11-30T16:23:49Z,CLOSED,['bug']
3204,UPDATE with correlated subquery causes assertion (or segfault),https://github.com/MonetDB/MonetDB/issues/6520,2020-11-30T16:23:51Z,CLOSED,['bug']
3205,"oderidx exists but cannot be found, and this goes through an always-failing assertion",https://github.com/MonetDB/MonetDB/issues/6521,2020-11-30T16:23:54Z,CLOSED,['bug']
3206,Sqlitelogictest: IN operator return a single column,https://github.com/MonetDB/MonetDB/issues/6522,2020-11-30T16:23:59Z,CLOSED,['bug']
3207,Sqlitelogictest: Case statement subquery missing,https://github.com/MonetDB/MonetDB/issues/6523,2020-11-30T16:24:02Z,CLOSED,['bug']
3208,Sqlitelogictest: Crash in aggregation query with IN operator,https://github.com/MonetDB/MonetDB/issues/6524,2020-11-30T16:24:05Z,CLOSED,['bug']
3209,Crash using aggregate function inside a case statement in having clause,https://github.com/MonetDB/MonetDB/issues/6526,2020-11-30T16:24:12Z,CLOSED,['bug']
3210,Crash using order by alias in subquery,https://github.com/MonetDB/MonetDB/issues/6527,2020-11-30T16:24:14Z,CLOSED,['bug']
3211,Sqlitelogictest crash in select query with IN operator and cast,https://github.com/MonetDB/MonetDB/issues/6529,2020-11-30T16:24:20Z,CLOSED,['bug']
3212,Sqlitelogictest: select query with NOT IN giving wrong results,https://github.com/MonetDB/MonetDB/issues/6530,2020-11-30T16:24:23Z,CLOSED,['bug']
3213,copy into ignore null as directive if first column doesn't come from file,https://github.com/MonetDB/MonetDB/issues/6532,2020-11-30T16:24:30Z,CLOSED,['bug']
3214,"[Mar2018]: mclient -f tab / --format=tab complains about ""unsupported formatter""",https://github.com/MonetDB/MonetDB/issues/6534,2020-11-30T16:24:37Z,CLOSED,['bug']
3215,[Mar2018]: mclient -t / --timer does not work as documented,https://github.com/MonetDB/MonetDB/issues/6535,2020-11-30T16:24:40Z,CLOSED,['bug']
